verse_number,arab,king_fahd,kemenag,google_translate
1, ٱلَّذِينَ كَفَرُوا۟ وَصَدُّوا۟ عَن سَبِيلِ ٱللَّهِ أَضَلَّ أَعْمَـٰلَهُمْ,"Orang-orang yang kafir dan menghalang-halangi (manusia) dari jalan Allah, Allah menghapus perbuatan-perbuatan mereka.","Orang-orang yang kafir dan menghalang-halangi (manusia) dari jalan Allah, maka Allah menghapus segala amal mereka.",Mereka yang tidak percaya dan mengusir jalan Tuhan
2,وَٱلَّذِينَ ءَامَنُوا۟ وَعَمِلُوا۟ ٱلصَّـٰلِحَـٰتِ وَءَامَنُوا۟ بِمَا نُزِّلَ عَلَىٰ مُحَمَّدٍ وَهُوَ ٱلْحَقُّ مِن رَّبِّهِمْ ۙ كَفَّرَ عَنْهُمْ سَيِّـَٔاتِهِمْ وَأَصْلَحَ بَالَهُمْ,"Dan orang-orang yang beriman (kepada Allah) dan mengerjakan amal-amal yang saleh serta beriman (pula) kepada apa yang diturunkan kepada Muhammad dan itulah yang hak dari Tuhan mereka, Allah menghapuskan kesalahan-kesalahan mereka dan memperbaiki keadaan mereka.","Dan orang-orang yang beriman (kepada Allah) dan mengerjakan kebajikan serta beriman kepada apa yang diturunkan kepada Muhammad, dan itulah kebenaran dari Tuhan mereka; Allah menghapus kesalahan-kesalahan mereka, dan memperbaiki keadaan mereka.","Dan mereka yang percaya dan melakukan kebenaran, dan mereka tidak pergi ke Muhammad dan mereka pandai"
3,ذَٰلِكَ بِأَنَّ ٱلَّذِينَ كَفَرُوا۟ ٱتَّبَعُوا۟ ٱلْبَـٰطِلَ وَأَنَّ ٱلَّذِينَ ءَامَنُوا۟ ٱتَّبَعُوا۟ ٱلْحَقَّ مِن رَّبِّهِمْ ۚ كَذَٰلِكَ يَضْرِبُ ٱللَّهُ لِلنَّاسِ أَمْثَـٰلَهُمْ,Yang demikian adalah karena sesungguhnya orang-orang kafir mengikuti yang batil dan sesungguhnya orang-orang yang beriman mengikuti yang hak dari Tuhan mereka.  Demikianlah Allah membuat untuk manusia perbandingan-perbandingan bagi mereka.,"Yang demikian itu, karena sesungguhnya orang-orang kafir mengikuti yang batil (sesat), dan sesungguhnya orang-orang yang beriman mengikuti kebenaran dari Tuhan mereka. Demikianlah Allah membuat perumpamaan-perumpamaan bagi manusia.","Itu adalah mereka yang tidak percaya, mengikuti sapi itu saya mewakili mereka"
4,فَإِذَا لَقِيتُمُ ٱلَّذِينَ كَفَرُوا۟ فَضَرْبَ ٱلرِّقَابِ حَتَّىٰٓ إِذَآ أَثْخَنتُمُوهُمْ فَشُدُّوا۟ ٱلْوَثَاقَ فَإِمَّا مَنًّۢا بَعْدُ وَإِمَّا فِدَآءً حَتَّىٰ تَضَعَ ٱلْحَرْبُ أَوْزَارَهَا ۚ ذَٰلِكَ وَلَوْ يَشَآءُ ٱللَّهُ لَٱنتَصَرَ مِنْهُمْ وَلَـٰكِن لِّيَبْلُوَا۟ بَعْضَكُم بِبَعْضٍ ۗ وَٱلَّذِينَ قُتِلُوا۟ فِى سَبِيلِ ٱللَّهِ فَلَن يُضِلَّ أَعْمَـٰلَهُمْ,"Apabila kamu bertemu dengan orang-orang kafir (di medan perang) maka pancunglah batang leher mereka.  Sehingga apabila kamu telah mengalahkan mereka, maka tawanlah mereka dan sesudah itu kamu boleh membebaskan mereka atau menerima tebusan sampai perang berhenti.  Demikianlah, apabila Allah menghendaki, niscaya Allah akan membinasakan mereka tetapi Allah hendak menguji sebagian kamu dengan sebagian yang lain.  Dan orang-orang yang gugur pada jalan Allah, Allah tidak akan menyia-nyiakan amal mereka.","Maka apabila kamu bertemu dengan orang-orang kafir (di medan perang), maka pukullah batang leher mereka. Selanjutnya apabila kamu telah mengalahkan mereka, tawanlah mereka, dan setelah itu kamu boleh membebaskan mereka atau menerima tebusan, sampai perang selesai. Demikianlah, dan sekiranya Allah menghendaki, niscaya Dia membinasakan mereka, tetapi Dia hendak menguji kamu satu sama lain. Dan orang-orang yang gugur di jalan Allah, maka Allah tidak akan menyia-nyiakan amal mereka.","Jadi jika Anda tidak tidak percaya, maka menyerang nama panggilan, sampai Anda melemparkannya, maka mereka mengencangkan dokumen, sehingga tidak sampai perang membuat kunjungannya ۚ itu, dan jika Tuhan akan diberkati, kita akan menang dari mereka, tetapi bagi Anda untuk menjadi lebih buruk, tetapi yang satu adalah ۗ ۗ ۗ ۗ ۗ ۗ ۗ ۗ ۗ ۗ ۗ ۗ ۗ ۗ ۗ ۗ ۗ ۗ ۗ ۗ ۗ ۗ ۗ ۗ ۗ ۗ ۗ ۗ ۗ ۗ ۗ ۗ ۗ ۗ ۗ ۗ ۗ ۗ ۗ ۗ ۗ ۗ ۗ ۗ ۗ ۗ"
5,سَيَهْدِيهِمْ وَيُصْلِحُ بَالَهُمْ,"Allah akan memberi pimpinan kepada mereka dan memperbaiki keadaan mereka,","Allah akan memberi petunjuk kepada mereka dan memperbaiki keadaan mereka,",Mereka akan membimbing mereka dan mendamaikan mereka
6,وَيُدْخِلُهُمُ ٱلْجَنَّةَ عَرَّفَهَا لَهُمْ,dan memasukkan mereka ke dalam surga yang telah diperkenalkan-Nya kepada mereka.,dan memasukkan mereka ke dalam surga yang telah diperkenalkan-Nya kepada mereka.,Surga memasuki mereka
7,يَـٰٓأَيُّهَا ٱلَّذِينَ ءَامَنُوٓا۟ إِن تَنصُرُوا۟ ٱللَّهَ يَنصُرْكُمْ وَيُثَبِّتْ أَقْدَامَكُمْ,"Hai orang-orang yang beriman, jika kamu menolong (agama) Allah, niscaya Dia akan menolongmu dan meneguhkan kedudukanmu.","Wahai orang-orang yang beriman! Jika kamu menolong (agama) Allah, niscaya Dia akan menolongmu dan meneguhkan kedudukanmu.","O, mereka yang aman, jika Anda akan menang, Tuhan memberkati Anda dan membuktikan kaki Anda"
8,وَٱلَّذِينَ كَفَرُوا۟ فَتَعْسًا لَّهُمْ وَأَضَلَّ أَعْمَـٰلَهُمْ,"Dan orang-orang yang kafir, maka kecelakaanlah bagi mereka dan Allah menghapus amal-amal mereka.","Dan orang-orang yang kafir, maka celakalah mereka, dan Allah menghapus segala amalnya.",Dan mereka yang tidak percaya dan sengsara untuk mereka dan yang terbaik dari berkat mereka
9,ذَٰلِكَ بِأَنَّهُمْ كَرِهُوا۟ مَآ أَنزَلَ ٱللَّهُ فَأَحْبَطَ أَعْمَـٰلَهُمْ,"Yang demikian itu adalah karena sesungguhnya mereka benci kepada apa yang diturunkan Allah (Al-Qur`ān), lalu Allah menghapuskan (pahala-pahala) amal-amal mereka.","Yang demikian itu karena mereka membenci apa (Alquran) yang diturunkan Allah, maka Allah menghapus segala amal mereka.","Itulah karena mereka tidak menyukai apa yang telah diturunkan Tuhan, jadi saya mencintai berkah mereka"
10,۞ أَفَلَمْ يَسِيرُوا۟ فِى ٱلْأَرْضِ فَيَنظُرُوا۟ كَيْفَ كَانَ عَـٰقِبَةُ ٱلَّذِينَ مِن قَبْلِهِمْ ۚ دَمَّرَ ٱللَّهُ عَلَيْهِمْ ۖ وَلِلْكَـٰفِرِينَ أَمْثَـٰلُهَا,Maka apakah mereka tidak mengadakan perjalanan di muka bumi sehingga mereka dapat memperhatikan bagaimana kesudahan orang-orang sebelum mereka; Allah telah menimpakan kebinasaan atas mereka dan orang-orang kafir akan menerima (akibat-akibat) seperti itu.,"Maka apakah mereka tidak pernah mengadakan perjalanan di bumi, sehingga dapat memperhatikan bagaimana kesudahan orang-orang yang sebelum mereka. Allah telah membinasakan mereka, dan bagi orang-orang kafir akan menerima (nasib) yang serupa.","۞ Apakah mereka tidak berjalan di tanah, sehingga mereka dapat melihat, bagaimana pangsit orang -orang di hadapan mereka ۚ Bader, Tuhan memberkati mereka dan untuk Anda dan untuk Anda."
11,ذَٰلِكَ بِأَنَّ ٱللَّهَ مَوْلَى ٱلَّذِينَ ءَامَنُوا۟ وَأَنَّ ٱلْكَـٰفِرِينَ لَا مَوْلَىٰ لَهُمْ,Yang demikian itu karena sesungguhnya Allah adalah pelindung orang-orang yang beriman dan karena sesungguhnya orang-orang kafir itu tiada mempunyai pelindung.,Yang demikian itu karena Allah pelindung bagi orang-orang yang beriman; sedang orang-orang kafir tidak ada pelindung bagi mereka.,Itulah bahwa Tuhan adalah orang yang percaya
12,إِنَّ ٱللَّهَ يُدْخِلُ ٱلَّذِينَ ءَامَنُوا۟ وَعَمِلُوا۟ ٱلصَّـٰلِحَـٰتِ جَنَّـٰتٍ تَجْرِى مِن تَحْتِهَا ٱلْأَنْهَـٰرُ ۖ وَٱلَّذِينَ كَفَرُوا۟ يَتَمَتَّعُونَ وَيَأْكُلُونَ كَمَا تَأْكُلُ ٱلْأَنْعَـٰمُ وَٱلنَّارُ مَثْوًى لَّهُمْ,"Sesungguhnya Allah memasukkan orang-orang yang beriman dan mengerjakan amal saleh ke dalam surga yang mengalir di bawahnya sungai-sungai.  Dan orang-orang yang kafir itu bersenang-senang (di dunia) dan mereka makan, seperti makannya binatang-binatang.  Dan neraka adalah tempat tinggal mereka.","Sungguh, Allah akan memasukkan orang-orang yang beriman dan mengerjakan kebajikan ke dalam surga yang mengalir di bawahnya sungai-sungai. Dan orang-orang yang kafir menikmati kesenangan (dunia), dan mereka makan seperti hewan makan; dan (kelak) nerakalah tempat tinggal bagi mereka.",Tuhan memasuki mereka yang telah percaya dan melakukan kebenaran yang berjalan dari mana mereka berlari dan mereka makan sebagai makan makan
13,وَكَأَيِّن مِّن قَرْيَةٍ هِىَ أَشَدُّ قُوَّةً مِّن قَرْيَتِكَ ٱلَّتِىٓ أَخْرَجَتْكَ أَهْلَكْنَـٰهُمْ فَلَا نَاصِرَ لَهُمْ,"Dan betapa banyaknya negeri-negeri yang (penduduknya) lebih kuat dari (penduduk) negerimu (Muhammad) yang telah mengusirmu itu.  Kami telah membinasakan mereka, maka tidak ada seorang penolong pun bagi mereka.",Dan betapa banyak negeri yang (penduduknya) lebih kuat dari (penduduk) negerimu (Muhammad) yang telah mengusirmu. Kami telah membinasakan mereka; maka tidak ada seorang pun yang menolong mereka.,"Dan juga dari sebuah desa, itu adalah yang paling kuat di desa Anda, untuk Anda, orang -orang Anda, untuk Anda, jadi kami tidak mendukung mereka"
14,أَفَمَن كَانَ عَلَىٰ بَيِّنَةٍ مِّن رَّبِّهِۦ كَمَن زُيِّنَ لَهُۥ سُوٓءُ عَمَلِهِۦ وَٱتَّبَعُوٓا۟ أَهْوَآءَهُم,Maka apakah orang yang berpegang pada keterangan yang datang dari Tuhan-nya sama dengan orang yang (setan) menjadikan dia memandang baik perbuatannya yang buruk itu dan mengikuti hawa nafsunya?,Maka apakah orang yang berpegang pada keterangan yang datang dari Tuhannya sama dengan orang yang dijadikan terasa indah baginya perbuatan buruknya dan mengikuti keinginannya?,"Apakah jelas baginya dari tuannya, sebagai seseorang yang telah menghiasinya dengan pekerjaannya"
15,مَّثَلُ ٱلْجَنَّةِ ٱلَّتِى وُعِدَ ٱلْمُتَّقُونَ ۖ فِيهَآ أَنْهَـٰرٌ مِّن مَّآءٍ غَيْرِ ءَاسِنٍ وَأَنْهَـٰرٌ مِّن لَّبَنٍ لَّمْ يَتَغَيَّرْ طَعْمُهُۥ وَأَنْهَـٰرٌ مِّنْ خَمْرٍ لَّذَّةٍ لِّلشَّـٰرِبِينَ وَأَنْهَـٰرٌ مِّنْ عَسَلٍ مُّصَفًّى ۖ وَلَهُمْ فِيهَا مِن كُلِّ ٱلثَّمَرَٰتِ وَمَغْفِرَةٌ مِّن رَّبِّهِمْ ۖ كَمَنْ هُوَ خَـٰلِدٌ فِى ٱلنَّارِ وَسُقُوا۟ مَآءً حَمِيمًا فَقَطَّعَ أَمْعَآءَهُمْ,"(Apakah) perumpamaan (penghuni) surga yang dijanjikan kepada orang-orang yang bertakwa yang di dalamnya ada sungai-sungai dari air yang tiada berubah rasa dan baunya, sungai-sungai dari air susu yang tiada berubah rasanya, sungai-sungai dari khamar (arak) yang lezat rasanya bagi peminumnya, dan sungai-sungai dari madu yang disaring; dan mereka memperoleh di dalamnya segala macam buah-buahan dan ampunan dari Tuhan mereka, sama dengan orang yang kekal dalam neraka dan diberi minuman dengan air yang mendidih sehingga memotong-motong ususnya?","Perumpamaan taman surga yang dijanjikan kepada orang-orang yang bertakwa; di sana ada sungai-sungai yang airnya tidak payau, dan sungai-sungai air susu yang tidak berubah rasanya, dan sungai-sungai khamar (anggur yang tidak memabukkan) yang lezat rasanya bagi peminumnya, dan sungai-sungai madu yang murni. Di dalamnya mereka memperoleh segala macam buah-buahan, dan ampunan dari Tuhan mereka. Samakah mereka dengan orang yang kekal dalam neraka, dan diberi minuman dengan air yang mendidih, sehingga ususnya terpotong-potong?","Contoh surga adalah yang memancarkan orang benar. Dari kilau kilau untuk kedua orang Arab, dan itu dari deskripsi madu. Di dalam api, mereka disiram, dan mereka memotong hati mereka."
16,وَمِنْهُم مَّن يَسْتَمِعُ إِلَيْكَ حَتَّىٰٓ إِذَا خَرَجُوا۟ مِنْ عِندِكَ قَالُوا۟ لِلَّذِينَ أُوتُوا۟ ٱلْعِلْمَ مَاذَا قَالَ ءَانِفًا ۚ أُو۟لَـٰٓئِكَ ٱلَّذِينَ طَبَعَ ٱللَّهُ عَلَىٰ قُلُوبِهِمْ وَٱتَّبَعُوٓا۟ أَهْوَآءَهُمْ,"Dan di antara mereka ada orang yang mendengarkan perkataanmu sehingga apabila mereka keluar dari sisimu, mereka berkata kepada orang yang telah diberi ilmu pengetahuan (sahabat-sahabat nabi), ""Apakah yang dikatakannya tadi?"" Mereka itulah orang-orang yang dikunci mati hati mereka oleh Allah dan mengikuti hawa nafsu mereka.","Dan di antara mereka ada orang yang mendengarkan perkataanmu (Muhammad), tetapi apabila mereka telah keluar dari sisimu, mereka berkata kepada orang yang telah diberi ilmu (sahabat-sahabat Nabi), ""Apakah yang dikatakannya tadi?"" Mereka itulah orang-orang yang dikunci hatinya oleh Allah, dan mengikuti keinginannya.","Beberapa dari mereka adalah mereka yang mendengarkan Anda sampai mereka dibebaskan, ketika mereka keluar dari Anda, mereka berkata kepada mereka yang telah memberi Anda pengetahuan tentang apa yang dia katakan: di hati mereka dan ikuti orang yang mereka cintai"
17,وَٱلَّذِينَ ٱهْتَدَوْا۟ زَادَهُمْ هُدًى وَءَاتَىٰهُمْ تَقْوَىٰهُمْ,"Dan orang-orang yang mendapat petunjuk, Allah menambah petunjuk kepada mereka dan memberikan kepada mereka (balasan) ketakwaannya.","Dan orang-orang yang mendapat petunjuk, Allah akan menambah petunjuk kepada mereka dan menganugerahi ketakwaan pada mereka.",Dan mereka yang membimbing mereka meningkatkan bimbingan mereka
18,فَهَلْ يَنظُرُونَ إِلَّا ٱلسَّاعَةَ أَن تَأْتِيَهُم بَغْتَةً ۖ فَقَدْ جَآءَ أَشْرَاطُهَا ۚ فَأَنَّىٰ لَهُمْ إِذَا جَآءَتْهُمْ ذِكْرَىٰهُمْ,"Maka tidaklah yang mereka tunggu-tunggu melainkan hari kiamat, (yaitu) kedatangannya kepada mereka dengan tiba-tiba, karena sesungguhnya telah datang tanda-tandanya.  Maka apakah faedahnya bagi mereka kesadaran mereka itu apabila hari kiamat sudah datang?","Maka apalagi yang mereka tunggu-tunggu selain hari Kiamat, yang akan datang kepada mereka secara tiba-tiba, karena tanda-tandanya sungguh telah datang. Maka apa gunanya bagi mereka kesadaran mereka itu, apabila (hari Kiamat) itu sudah datang?",Apakah mereka hanya mencari jam untuk datang kepada mereka dengan pelacur?
19,فَٱعْلَمْ أَنَّهُۥ لَآ إِلَـٰهَ إِلَّا ٱللَّهُ وَٱسْتَغْفِرْ لِذَنۢبِكَ وَلِلْمُؤْمِنِينَ وَٱلْمُؤْمِنَـٰتِ ۗ وَٱللَّهُ يَعْلَمُ مُتَقَلَّبَكُمْ وَمَثْوَىٰكُمْ,"Maka ketahuilah, bahwa sesungguhnya tidak ada Tuhan (yang hak) melainkan Allah dan mohonlah ampunan bagi dosamu dan bagi (dosa) orang-orang mukmin, laki-laki dan perempuan.  Dan Allah mengetahui tempat kamu berusaha dan tempat kamu tinggal.","Maka ketahuilah, bahwa tidak ada tuhan (yang patut disembah) selain Allah, dan mohonlah ampunan atas dosamu dan atas (dosa) orang-orang mukmin, laki-laki dan perempuan. Dan Allah mengetahui tempat usaha dan tempat tinggalmu.",Jadi dia tahu bahwa tidak ada Tuhan selain Tuhan dan meminta pengampunan atas kebajikan Anda dan orang -orang percaya dan orang -orang percaya
20,وَيَقُولُ ٱلَّذِينَ ءَامَنُوا۟ لَوْلَا نُزِّلَتْ سُورَةٌ ۖ فَإِذَآ أُنزِلَتْ سُورَةٌ مُّحْكَمَةٌ وَذُكِرَ فِيهَا ٱلْقِتَالُ ۙ رَأَيْتَ ٱلَّذِينَ فِى قُلُوبِهِم مَّرَضٌ يَنظُرُونَ إِلَيْكَ نَظَرَ ٱلْمَغْشِىِّ عَلَيْهِ مِنَ ٱلْمَوْتِ ۖ فَأَوْلَىٰ لَهُمْ,"Dan orang-orang yang beriman berkata, ""Mengapa tiada diturunkan suatu surah?"" Maka apabila diturunkan suatu surah yang jelas maksudnya dan disebutkan di dalamnya (perintah) perang, kamu lihat orang-orang yang ada penyakit di dalam hatinya memandang kepadamu seperti pandangan orang yang pingsan karena takut mati, dan kecelakaanlah bagi mereka.","Dan orang-orang yang beriman berkata, ""Mengapa tidak ada suatu surah (tentang perintah jihad) yang diturunkan?"" Maka apabila ada suatu surah diturunkan yang jelas maksudnya dan di dalamnya terdapat (perintah) perang, engkau melihat orang-orang yang di dalam hatinya ada penyakit akan memandang kepadamu seperti pandangan orang yang pingsan karena takut mati. Tetapi itu lebih pantas bagi mereka.","Dan dia berkata: “Mereka yang percaya ', jika tidak ada Surat, maka Surat terungkap, dan seorang penguasa terungkap, dan disebutkan di dalamnya. Penyakit yang mereka lihat pada Anda."
21,طَاعَةٌ وَقَوْلٌ مَّعْرُوفٌ ۚ فَإِذَا عَزَمَ ٱلْأَمْرُ فَلَوْ صَدَقُوا۟ ٱللَّهَ لَكَانَ خَيْرًا لَّهُمْ,"Taat dan mengucapkan perkataan yang baik (adalah lebih baik bagi mereka).  Apabila telah tetap perintah perang (mereka tidak menyukainya).  Tetapi jikalau mereka benar (imannya) terhadap Allah, niscaya yang demikian itu lebih baik bagi mereka.","(Yang lebih baik bagi mereka adalah) taat (kepada Allah) dan bertutur kata yang baik. Sebab apabila perintah (perang) ditetapkan (mereka tidak menyukainya). Padahal jika mereka benar-benar (beriman) kepada Allah, niscaya yang demikian itu lebih baik bagi mereka.",Kepatuhan dan pepatah yang diketahui ۚ jadi jika dia menentukan masalah ini
22,فَهَلْ عَسَيْتُمْ إِن تَوَلَّيْتُمْ أَن تُفْسِدُوا۟ فِى ٱلْأَرْضِ وَتُقَطِّعُوٓا۟ أَرْحَامَكُمْ,Maka apakah kiranya jika kamu berkuasa kamu akan membuat kerusakan di muka bumi dan memutuskan hubungan kekeluargaan?,"Maka apakah sekiranya kamu berkuasa, lalu kamu akan berbuat kerusakan di bumi dan memutuskan hubungan kekeluargaan?","Jadi, bolehkah Anda merawat Anda untuk dimanjakan di tanah dan memotong belas kasihan Anda?"
23,أُو۟لَـٰٓئِكَ ٱلَّذِينَ لَعَنَهُمُ ٱللَّهُ فَأَصَمَّهُمْ وَأَعْمَىٰٓ أَبْصَـٰرَهُمْ,Mereka itulah orang-orang yang dilaknati Allah dan ditulikan-Nya telinga mereka dan dibutakan-Nya penglihatan mereka.,Mereka itulah orang-orang yang dikutuk Allah; lalu dibuat tuli (pendengarannya) dan dibutakan penglihatannya.,"Mereka yang adalah mereka yang mengutuk mereka, Tuhan memberkati mereka dan membutakan mereka."
24,أَفَلَا يَتَدَبَّرُونَ ٱلْقُرْءَانَ أَمْ عَلَىٰ قُلُوبٍ أَقْفَالُهَآ,Maka apakah mereka tidak memperhatikan Al-Qur`ān ataukah hati mereka terkunci?,"Maka tidakkah mereka menghayati Alquran, ataukah hati mereka sudah terkunci?","Apakah mereka tidak mengelola pembaca, atau di hati kunci mereka?"
25,إِنَّ ٱلَّذِينَ ٱرْتَدُّوا۟ عَلَىٰٓ أَدْبَـٰرِهِم مِّنۢ بَعْدِ مَا تَبَيَّنَ لَهُمُ ٱلْهُدَى ۙ ٱلشَّيْطَـٰنُ سَوَّلَ لَهُمْ وَأَمْلَىٰ لَهُمْ,"Sesungguhnya orang-orang yang kembali ke belakang (kepada kekafiran) sesudah petunjuk itu jelas bagi mereka, setan telah menjadikan mereka mudah (berbuat dosa) dan memanjangkan angan-angan mereka.","Sesungguhnya orang-orang yang berbalik (kepada kekafiran) setelah petunjuk itu jelas bagi mereka, setanlah yang merayu mereka dan memanjangkan angan-angan mereka.","Bagi mereka yang terikat oleh literatur mereka, setelah apa yang diungkapkan kepada mereka, bimbingan ۙ ٱ ٱ ٱ ٱ ٱ ۙ ۙ"
26,ذَٰلِكَ بِأَنَّهُمْ قَالُوا۟ لِلَّذِينَ كَرِهُوا۟ مَا نَزَّلَ ٱللَّهُ سَنُطِيعُكُمْ فِى بَعْضِ ٱلْأَمْرِ ۖ وَٱللَّهُ يَعْلَمُ إِسْرَارَهُمْ,"Yang demikian itu karena sesungguhnya mereka (orang-orang munafik) itu berkata kepada orang-orang yang benci kepada apa yang diturunkan Allah (orang-orang Yahudi), ""Kami akan mematuhi kamu dalam beberapa urusan"", sedang Allah mengetahui rahasia mereka.","Yang demikian itu, karena sesungguhnya mereka telah mengatakan kepada orang-orang (Yahudi) yang tidak senang kepada apa yang diturunkan Allah, ""Kami akan mematuhi kamu dalam beberapa urusan,"" tetapi Allah mengetahui rahasia mereka.",Itu adalah mereka berkata kepada mereka yang telah menghilang
27,فَكَيْفَ إِذَا تَوَفَّتْهُمُ ٱلْمَلَـٰٓئِكَةُ يَضْرِبُونَ وُجُوهَهُمْ وَأَدْبَـٰرَهُمْ,Bagaimanakah (keadaan mereka) apabila malaikat (maut) mencabut nyawa mereka seraya memukul muka mereka dan punggung mereka?,"Maka bagaimana (nasib mereka) apabila malaikat (maut) mencabut nyawa mereka, memukul wajah dan punggung mereka?",Bagaimana Anda merindukan mereka
28,ذَٰلِكَ بِأَنَّهُمُ ٱتَّبَعُوا۟ مَآ أَسْخَطَ ٱللَّهَ وَكَرِهُوا۟ رِضْوَٰنَهُۥ فَأَحْبَطَ أَعْمَـٰلَهُمْ,"Yang demikian itu adalah karena sesungguhnya mereka mengikuti apa yang menimbulkan kemurkaan Allah dan (karena mereka membenci) apa yang menimbulkan keridaan-Nya; sebab itu, Allah menghapus (pahala) amal-amal mereka.","Yang demikian itu, karena sesungguhnya mereka mengikuti apa yang menimbulkan kemurkaan Allah dan membenci (apa yang menimbulkan) keridaan-Nya; sebab itu Allah menghapus segala amal mereka.","Itulah mereka mengikuti apa yang telah saya rencanakan kepada Tuhan, dan semoga Tuhan senang dengan Anda"
29,أَمْ حَسِبَ ٱلَّذِينَ فِى قُلُوبِهِم مَّرَضٌ أَن لَّن يُخْرِجَ ٱللَّهُ أَضْغَـٰنَهُمْ,Atau apakah orang-orang yang ada penyakit dalam hatinya mengira bahwa Allah tidak akan menampakkan kedengkian mereka?,Atau apakah orang-orang yang dalam hatinya ada penyakit mengira bahwa Allah tidak akan menampakkan kedengkian mereka?,Atau orang yang ada di hati mereka
30,وَلَوْ نَشَآءُ لَأَرَيْنَـٰكَهُمْ فَلَعَرَفْتَهُم بِسِيمَـٰهُمْ ۚ وَلَتَعْرِفَنَّهُمْ فِى لَحْنِ ٱلْقَوْلِ ۚ وَٱللَّهُ يَعْلَمُ أَعْمَـٰلَكُمْ,"Dan kalau Kami kehendaki, niscaya Kami tunjukkan mereka kepadamu sehingga kamu benar-benar dapat mengenal mereka dengan tanda-tandanya.  Dan kamu benar-benar akan mengenal mereka dari kiasan-kiasan perkataan mereka dan Allah mengetahui perbuatan-perbuatan kamu.","Dan sekiranya Kami menghendaki, niscaya Kami perlihatkan mereka kepadamu (Muhammad) sehingga engkau benar-benar dapat mengenal mereka dengan tanda-tandanya. Dan engkau benar-benar akan mengenal mereka dari nada bicaranya, dan Allah mengetahui segala perbuatan kamu.","Dan jika kita akan melihat mereka, saya akan mengenal mereka dengan nama mereka."
31,وَلَنَبْلُوَنَّكُمْ حَتَّىٰ نَعْلَمَ ٱلْمُجَـٰهِدِينَ مِنكُمْ وَٱلصَّـٰبِرِينَ وَنَبْلُوَا۟ أَخْبَارَكُمْ,Dan sesungguhnya Kami benar-benar akan menguji kamu agar Kami mengetahui orang-orang yang berjihad dan bersabar di antara kamu; dan agar Kami menyatakan (baik buruknya) hal ihwalmu.,"Dan sungguh, Kami benar-benar akan menguji kamu sehingga Kami mengetahui orang-orang yang benar-benar berjihad dan bersabar di antara kamu; dan akan Kami uji perihal kamu.",Dan beri tahu kami bahwa kami tahu dari Anda dan Downs.
32,إِنَّ ٱلَّذِينَ كَفَرُوا۟ وَصَدُّوا۟ عَن سَبِيلِ ٱللَّهِ وَشَآقُّوا۟ ٱلرَّسُولَ مِنۢ بَعْدِ مَا تَبَيَّنَ لَهُمُ ٱلْهُدَىٰ لَن يَضُرُّوا۟ ٱللَّهَ شَيْـًٔا وَسَيُحْبِطُ أَعْمَـٰلَهُمْ,"Sesungguhnya orang-orang kafir dan menghalangi (manusia) dari jalan Allah serta memusuhi rasul setelah petunjuk itu jelas bagi mereka, mereka tidak dapat memberi mudarat kepada Allah sedikit pun.  Dan Allah akan menghapuskan (pahala) amal-amal mereka.","Sesungguhnya orang-orang yang kafir dan menghalang-halangi (orang lain) dari jalan Allah serta memusuhi rasul setelah ada petunjuk yang jelas bagi mereka, mereka tidak akan dapat memberi mudarat (bahaya) kepada Allah sedikit pun. Dan kelak Allah akan menghapus segala amal mereka.","Bagi mereka yang tidak percaya dan mengusir jalan Allah dan utusan utusan setelah apa yang jelas bagi mereka, bimbingan, dan mereka tidak akan berbahaya bagi mereka orang -orang mereka"
