verse_number,arab,king_fahd,kemenag,google_translate
33,۞ يَـٰٓأَيُّهَا ٱلَّذِينَ ءَامَنُوٓا۟ أَطِيعُوا۟ ٱللَّهَ وَأَطِيعُوا۟ ٱلرَّسُولَ وَلَا تُبْطِلُوٓا۟ أَعْمَـٰلَكُمْ,"Hai orang-orang yang beriman, taatlah kepada Allah dan taatlah kepada rasul dan janganlah kamu merusakkan (pahala) amal-amalmu.","Wahai orang-orang yang beriman! Taatlah kepada Allah dan taatlah kepada Rasul, dan janganlah kamu merusakkan segala amalmu!","۞ o, mereka yang aman"
34,إِنَّ ٱلَّذِينَ كَفَرُوا۟ وَصَدُّوا۟ عَن سَبِيلِ ٱللَّهِ ثُمَّ مَاتُوا۟ وَهُمْ كُفَّارٌ فَلَن يَغْفِرَ ٱللَّهُ لَهُمْ,"Sesungguhnya orang-orang yang kafir dan menghalangi manusia dari jalan Allah kemudian mereka mati dalam keadaan kafir, maka sekali-kali Allah tidak akan memberi ampun kepada mereka.","Sesungguhnya orang-orang yang kafir dan menghalang-halangi (orang lain) dari jalan Allah, kemudian mereka mati dalam keadaan kafir, maka Allah tidak akan mengampuni mereka.","Bagi mereka yang tidak percaya dan mengusir Anda dari jalan Tuhan, lalu mereka mati, dan mereka tidak percaya, jadi Tuhan tidak akan diampuni untuk mereka"
35,فَلَا تَهِنُوا۟ وَتَدْعُوٓا۟ إِلَى ٱلسَّلْمِ وَأَنتُمُ ٱلْأَعْلَوْنَ وَٱللَّهُ مَعَكُمْ وَلَن يَتِرَكُمْ أَعْمَـٰلَكُمْ,Janganlah kamu lemah dan minta damai padahal kamulah yang di atas dan Allah (pun) beserta kamu dan Dia sekali-kali tidak akan mengurangi pahala amal-amalmu.,"Maka janganlah kamu lemah dan mengajak damai, karena kamulah yang lebih unggul, dan Allah (pun) bersama kamu, dan Dia tidak akan mengurangi segala amalmu.","Jangan berhati -hati dan berdoa untuk Islam, dan Anda adalah yang tertinggi, dan Tuhan memberkati Anda"
36,إِنَّمَا ٱلْحَيَوٰةُ ٱلدُّنْيَا لَعِبٌ وَلَهْوٌ ۚ وَإِن تُؤْمِنُوا۟ وَتَتَّقُوا۟ يُؤْتِكُمْ أُجُورَكُمْ وَلَا يَسْـَٔلْكُمْ أَمْوَٰلَكُمْ,"Sesungguhnya kehidupan dunia hanyalah permainan dan senda gurau.  Dan jika kamu beriman serta bertakwa, Allah akan memberikan pahala kepadamu dan Dia tidak akan meminta harta-hartamu.","Sesungguhnya kehidupan dunia itu hanyalah permainan dan senda gurau. Jika kamu beriman serta bertakwa, Allah akan memberikan pahala kepadamu, dan Dia tidak akan meminta hartamu.","Sebaliknya, kehidupan dunia ini adalah permainan dan kesenangan ۚ dan jika Anda percaya pada Anda dan takut pada Anda, Anda akan membayar Anda untuk upah Anda, Anda juga tidak cocok untuk Anda"
37,إِن يَسْـَٔلْكُمُوهَا فَيُحْفِكُمْ تَبْخَلُوا۟ وَيُخْرِجْ أَضْغَـٰنَكُمْ,"Jika Dia meminta harta kepadamu lalu mendesak kamu (supaya memberikan semuanya), niscaya kamu akan kikir dan Dia akan menampakkan kedengkianmu.","Sekiranya Dia meminta harta kepadamu lalu mendesak kamu (agar memberikan semuanya) niscaya kamu akan kikir, dan Dia akan menampakkan kedengkianmu.","Jika mereka akan diberkati, maka mereka akan membantu Anda"
38,هَـٰٓأَنتُمْ هَـٰٓؤُلَآءِ تُدْعَوْنَ لِتُنفِقُوا۟ فِى سَبِيلِ ٱللَّهِ فَمِنكُم مَّن يَبْخَلُ ۖ وَمَن يَبْخَلْ فَإِنَّمَا يَبْخَلُ عَن نَّفْسِهِۦ ۚ وَٱللَّهُ ٱلْغَنِىُّ وَأَنتُمُ ٱلْفُقَرَآءُ ۚ وَإِن تَتَوَلَّوْا۟ يَسْتَبْدِلْ قَوْمًا غَيْرَكُمْ ثُمَّ لَا يَكُونُوٓا۟ أَمْثَـٰلَكُم,"Ingatlah, kamu ini orang-orang yang diajak untuk menafkahkan (hartamu) pada jalan Allah.  Maka di antara kamu ada yang kikir, dan siapa yang kikir sesungguhnya dia hanyalah kikir terhadap dirinya sendiri.  Dan Allah-lah yang Maha Kaya sedangkan kamulah orang-orang yang membutuhkan-(Nya); dan jika kamu berpaling, niscaya Dia akan mengganti (kamu) dengan kaum yang lain, dan mereka tidak akan seperti kamu ini.","Ingatlah, kamu adalah orang-orang yang diajak untuk menginfakkan (hartamu) di jalan Allah. Lalu di antara kamu ada orang yang kikir, dan barangsiapa kikir maka sesungguhnya dia kikir terhadap dirinya sendiri. Dan Allah lah Yang Mahakaya, dan kamulah yang membutuhkan (karunia-Nya). Dan jika kamu berpaling (dari jalan yang benar) Dia akan menggantikan (kamu) dengan kaum yang lain, dan mereka tidak akan (durhaka) seperti kamu.","Anda adalah orang -orang yang berdoa agar Anda sukses di jalan Tuhan dan Anda adalah kemiskinan ۚ dan jika Anda menjaga Anda, orang -orang akan diubah, maka Anda tidak akan menjadi"
