verse_number,arab,king_fahd,kemenag,google_translate
1, سَبَّحَ لِلَّهِ مَا فِى ٱلسَّمَـٰوَٰتِ وَمَا فِى ٱلْأَرْضِ ۖ وَهُوَ ٱلْعَزِيزُ ٱلْحَكِيمُ,Bertasbih kepada Allah apa yang ada di langit dan apa yang ada di bumi; dan Dia-lah Yang Maha Perkasa lagi Maha Bijaksana.,"Apa yang ada di langit dan apa yang ada di bumi bertasbih kepada Allah; dan Dialah Yang Mahaperkasa, Mahabijaksana.","Puji menjadi Tuhan, apa yang ada di langit dan apa yang ada di bumi."
2,هُوَ ٱلَّذِىٓ أَخْرَجَ ٱلَّذِينَ كَفَرُوا۟ مِنْ أَهْلِ ٱلْكِتَـٰبِ مِن دِيَـٰرِهِمْ لِأَوَّلِ ٱلْحَشْرِ ۚ مَا ظَنَنتُمْ أَن يَخْرُجُوا۟ ۖ وَظَنُّوٓا۟ أَنَّهُم مَّانِعَتُهُمْ حُصُونُهُم مِّنَ ٱللَّهِ فَأَتَىٰهُمُ ٱللَّهُ مِنْ حَيْثُ لَمْ يَحْتَسِبُوا۟ ۖ وَقَذَفَ فِى قُلُوبِهِمُ ٱلرُّعْبَ ۚ يُخْرِبُونَ بُيُوتَهُم بِأَيْدِيهِمْ وَأَيْدِى ٱلْمُؤْمِنِينَ فَٱعْتَبِرُوا۟ يَـٰٓأُو۟لِى ٱلْأَبْصَـٰرِ,"Dia-lah yang mengeluarkan orang-orang kafir di antara ahli kitab dari kampung-kampung mereka pada saat pengusiran kali yang pertama.  Kamu tiada menyangka bahwa mereka akan keluar dan mereka pun yakin bahwa benteng-benteng mereka akan dapat mempertahankan mereka dari (siksaan) Allah; maka Allah mendatangkan kepada mereka (hukuman) dari arah yang tidak mereka sangka-sangka.  Dan Allah mencampakkan ketakutan ke dalam hati mereka; mereka memusnahkan rumah-rumah mereka dengan tangan mereka sendiri dan tangan orang-orang yang beriman.  Maka ambillah (kejadian itu) untuk menjadi pelajaran, hai orang-orang yang mempunyai pandangan.","Dialah yang mengeluarkan orang-orang kafir di antara Ahli Kitab dari kampung halamannya pada saat pengusiran yang pertama. Kamu tidak menyangka, bahwa mereka akan keluar dan mereka pun yakin, benteng-benteng mereka akan dapat mempertahankan mereka dari (siksaan) Allah; maka Allah mendatangkan (siksaan) kepada mereka dari arah yang tidak mereka sangka-sangka. Dan Allah menanamkan rasa takut ke dalam hati mereka; sehingga mereka memusnahkan rumah-rumah mereka dengan tangannya sendiri dan tangan orang-orang mukmin. Maka ambillah (kejadian itu) untuk menjadi pelajaran, wahai orang-orang yang mempunyai pandangan!","Dia adalah orang yang membawa orang -orang yang tidak percaya dari orang -orang Raja dari agama mereka untuk pertama kalinya apa yang mereka diimunisasi adalah benteng mereka dari Tuhan, jadi Tuhan membawa mereka dari tempat mereka tidak mengutuk mereka. Dan orang -orang percaya orang -orang percaya, jadi diperhitungkan."
3,وَلَوْلَآ أَن كَتَبَ ٱللَّهُ عَلَيْهِمُ ٱلْجَلَآءَ لَعَذَّبَهُمْ فِى ٱلدُّنْيَا ۖ وَلَهُمْ فِى ٱلْـَٔاخِرَةِ عَذَابُ ٱلنَّارِ,"Dan jikalau tidaklah karena Allah telah menetapkan pengusiran terhadap mereka, benar-benar Allah mengazab mereka di dunia.  Dan bagi mereka di akhirat azab neraka.","Dan sekiranya tidak karena Allah telah menetapkan pengusiran terhadap mereka, pasti Allah mengazab mereka di dunia. Dan di akhirat mereka akan mendapat azab neraka.","Dan jika saja Tuhan menulis kepada mereka, semoga Tuhan disiksa di dunia ini."
4,ذَٰلِكَ بِأَنَّهُمْ شَآقُّوا۟ ٱللَّهَ وَرَسُولَهُۥ ۖ وَمَن يُشَآقِّ ٱللَّهَ فَإِنَّ ٱللَّهَ شَدِيدُ ٱلْعِقَابِ,"Yang demikian itu adalah karena sesungguhnya mereka menentang Allah dan rasul-Nya. Barang siapa menentang Allah, maka sesungguhnya Allah sangat keras hukuman-Nya.","Yang demikian itu karena sesungguhnya mereka menentang Allah dan Rasul-Nya. Barangsiapa menentang Allah, maka sesungguhnya Allah sangat keras hukuman-Nya.",Itulah mereka telah diberkati dengan Tuhan dan utusan -Nya
5,مَا قَطَعْتُم مِّن لِّينَةٍ أَوْ تَرَكْتُمُوهَا قَآئِمَةً عَلَىٰٓ أُصُولِهَا فَبِإِذْنِ ٱللَّهِ وَلِيُخْزِىَ ٱلْفَـٰسِقِينَ,"Apa saja yang kamu tebang dari pohon kurma (milik orang-orang kafir) atau yang kamu biarkan (tumbuh) berdiri di atas pokoknya, maka (semua itu) adalah dengan izin Allah; dan karena Dia hendak memberikan kehinaan kepada orang-orang fasik.","Apa yang kamu tebang di antara pohon kurma (milik orang-orang kafir) atau yang kamu biarkan (tumbuh) berdiri di atas pokoknya, maka (itu terjadi) dengan izin Allah; dan karena Dia hendak memberikan kehinaan kepada orang-orang fasik.","Apa yang telah Anda sita dari kelembutan, atau meninggalkannya, mereka didasarkan pada asal -usulnya."
6,وَمَآ أَفَآءَ ٱللَّهُ عَلَىٰ رَسُولِهِۦ مِنْهُمْ فَمَآ أَوْجَفْتُمْ عَلَيْهِ مِنْ خَيْلٍ وَلَا رِكَابٍ وَلَـٰكِنَّ ٱللَّهَ يُسَلِّطُ رُسُلَهُۥ عَلَىٰ مَن يَشَآءُ ۚ وَٱللَّهُ عَلَىٰ كُلِّ شَىْءٍ قَدِيرٌ,"Dan apa saja harta rampasan (fay`) yang diberikan Allah kepada rasul-Nya (dari harta benda) mereka, maka untuk mendapatkan itu kamu tidak mengerahkan seekor kuda pun dan (tidak pula) seekor unta pun, tetapi Allah yang memberikan kekuasaan kepada rasul-Nya terhadap siapa yang dikehendaki-Nya.  Dan Allah Maha Kuasa atas segala sesuatu.","Dan harta rampasan fai` dari mereka yang diberikan Allah kepada Rasul-Nya, kamu tidak memerlukan kuda atau unta untuk mendapatkannya, tetapi Allah memberikan kekuasaan kepada rasul-rasul-Nya terhadap siapa yang Dia kehendaki. Dan Allah Mahakuasa atas segala sesuatu.","Dan ketika Tuhan berada di utusan -Nya tentang mereka, maka apa yang telah Anda kenal dengan dia dari kuda, atau penumpang, dan bagi Tuhan, Tuhan memberkati dia dan utusan -Nya sebagai hal yang mampu menjadi hal yang mampu"
7,مَّآ أَفَآءَ ٱللَّهُ عَلَىٰ رَسُولِهِۦ مِنْ أَهْلِ ٱلْقُرَىٰ فَلِلَّهِ وَلِلرَّسُولِ وَلِذِى ٱلْقُرْبَىٰ وَٱلْيَتَـٰمَىٰ وَٱلْمَسَـٰكِينِ وَٱبْنِ ٱلسَّبِيلِ كَىْ لَا يَكُونَ دُولَةًۢ بَيْنَ ٱلْأَغْنِيَآءِ مِنكُمْ ۚ وَمَآ ءَاتَىٰكُمُ ٱلرَّسُولُ فَخُذُوهُ وَمَا نَهَىٰكُمْ عَنْهُ فَٱنتَهُوا۟ ۚ وَٱتَّقُوا۟ ٱللَّهَ ۖ إِنَّ ٱللَّهَ شَدِيدُ ٱلْعِقَابِ,"Apa saja harta rampasan (fay`) yang diberikan Allah kepada rasul-Nya (dari harta benda) yang berasal dari penduduk kota-kota maka adalah untuk Allah, rasul, kerabat rasul, anak-anak yatim, orang-orang miskin, dan orang-orang yang dalam perjalanan, supaya harta itu jangan hanya beredar di antara orang-orang kaya saja di antara kamu.  Apa yang diberikan rasul kepadamu maka terimalah dia.  Dan apa yang dilarangnya bagimu, maka tinggalkanlah; dan bertakwalah kepada Allah.  Sesungguhnya Allah sangat keras hukuman-Nya.","Harta rampasan fai` yang diberikan Allah kepada Rasul-Nya (yang berasal) dari penduduk beberapa negeri, adalah untuk Allah, Rasul, kerabat (Rasul), anak-anak yatim, orang-orang miskin dan untuk orang-orang yang dalam perjalanan, agar harta itu jangan hanya beredar di antara orang-orang kaya saja di antara kamu. Apa yang diberikan Rasul kepadamu maka terimalah. Dan apa yang dilarangnya bagimu maka tinggalkanlah. Dan bertakwalah kepada Allah. Sungguh, Allah sangat keras hukuman-Nya.","Ketika Tuhan menjadi otoritas utusan -Nya dari orang -orang di desa -desa, Tuhan dan utusan, dan bagi mereka yang dekat dengan Tuhan itu akan menjadi keadaan di antara lagu -lagu Anda ۚ dan apa yang akan membuat Anda menghukum Anda"
8,لِلْفُقَرَآءِ ٱلْمُهَـٰجِرِينَ ٱلَّذِينَ أُخْرِجُوا۟ مِن دِيَـٰرِهِمْ وَأَمْوَٰلِهِمْ يَبْتَغُونَ فَضْلًا مِّنَ ٱللَّهِ وَرِضْوَٰنًا وَيَنصُرُونَ ٱللَّهَ وَرَسُولَهُۥٓ ۚ أُو۟لَـٰٓئِكَ هُمُ ٱلصَّـٰدِقُونَ,(Juga) bagi para fukara yang berhijrah yang diusir dari kampung halaman dan dari harta benda mereka (karena) mencari karunia dari Allah dan keridaan-Nya dan mereka menolong Allah dan rasul-Nya.  Mereka itulah orang-orang yang benar.,(Harta rampasan itu juga) untuk orang-orang fakir yang berhijrah yang terusir dari kampung halamannya dan meninggalkan harta bendanya demi mencari karunia dari Allah dan keridaan(-Nya) dan (demi) menolong (agama) Allah dan Rasul-Nya. Mereka itulah orang-orang yang benar.,Bagi orang miskin yang dibawa keluar dari agama mereka dan utusannya ۚ atau itu adalah pencuri
9,وَٱلَّذِينَ تَبَوَّءُو ٱلدَّارَ وَٱلْإِيمَـٰنَ مِن قَبْلِهِمْ يُحِبُّونَ مَنْ هَاجَرَ إِلَيْهِمْ وَلَا يَجِدُونَ فِى صُدُورِهِمْ حَاجَةً مِّمَّآ أُوتُوا۟ وَيُؤْثِرُونَ عَلَىٰٓ أَنفُسِهِمْ وَلَوْ كَانَ بِهِمْ خَصَاصَةٌ ۚ وَمَن يُوقَ شُحَّ نَفْسِهِۦ فَأُو۟لَـٰٓئِكَ هُمُ ٱلْمُفْلِحُونَ,"Dan orang-orang yang telah menempati kota Madinah dan telah beriman (Ansar) sebelum (kedatangan) mereka (Muhajirin), mereka mencintai orang yang berhijrah kepada mereka.  Dan mereka tiada menaruh keinginan dalam hati mereka terhadap apa-apa yang diberikan kepada mereka (orang Muhajirin); dan mereka mengutamakan (orang-orang Muhajirin), atas diri mereka sendiri, sekalipun mereka memerlukan (apa yang mereka berikan ini).  Dan siapa yang dipelihara dari kekikiran dirinya, mereka itulah orang orang yang beruntung","Dan orang-orang (Ansar) yang telah menempati kota Madinah dan telah beriman sebelum (kedatangan) mereka (Muhajirin), mereka mencintai orang yang berhijrah ke tempat mereka. Dan mereka tidak menaruh keinginan dalam hati mereka terhadap apa yang diberikan kepada mereka (Muhajirin); dan mereka mengutamakan (Muhajirin), atas dirinya sendiri, meskipun mereka juga memerlukan. Dan siapa yang dijaga dirinya dari kekikiran, maka mereka itulah orang-orang yang beruntung.","Dan mereka yang berada di rumah dan keunggulan di hadapan mereka, mereka mencintai mereka yang telah dimigrasi ke mereka, dan mereka tidak menemukan di payudara mereka, dan mereka membutuhkan sendiri, dan jika mereka memiliki yang istimewa ۚ dan siapa pun yang memiliki kelangkaan dirinya sendiri, maka mereka adalah orang -orang yang."
10,وَٱلَّذِينَ جَآءُو مِنۢ بَعْدِهِمْ يَقُولُونَ رَبَّنَا ٱغْفِرْ لَنَا وَلِإِخْوَٰنِنَا ٱلَّذِينَ سَبَقُونَا بِٱلْإِيمَـٰنِ وَلَا تَجْعَلْ فِى قُلُوبِنَا غِلًّا لِّلَّذِينَ ءَامَنُوا۟ رَبَّنَآ إِنَّكَ رَءُوفٌ رَّحِيمٌ,"Dan orang-orang yang datang sesudah mereka (Muhajirin dan Ansar), mereka berdoa, ""Ya Tuhan kami, beri ampunlah kami dan saudara-saudara kami yang telah beriman lebih dulu dari kami, dan janganlah Engkau membiarkan kedengkian dalam hati kami terhadap orang-orang yang beriman; Ya Tuhan kami, sesungguhnya Engkau Maha Penyantun lagi Maha Penyayang"".","Dan orang-orang yang datang sesudah mereka (Muhajirin dan Ansar), mereka berdoa, ""Ya Tuhan kami, ampunilah kami dan saudara-saudara kami yang telah beriman lebih dahulu dari kami, dan janganlah Engkau tanamkan kedengkian dalam hati kami terhadap orang-orang yang beriman. Ya Tuhan kami, sungguh, Engkau Maha Penyantun, Maha Penyayang.""","Dan mereka yang datang setelah mereka berkata kepada Tuhan kita, mengampuni kita dan saudara -saudara kita yang memiliki di hadapan kita untuk mereka yang percaya, Tuhan kita, kamu adalah kepala yang penuh belas kasihan."
11,۞ أَلَمْ تَرَ إِلَى ٱلَّذِينَ نَافَقُوا۟ يَقُولُونَ لِإِخْوَٰنِهِمُ ٱلَّذِينَ كَفَرُوا۟ مِنْ أَهْلِ ٱلْكِتَـٰبِ لَئِنْ أُخْرِجْتُمْ لَنَخْرُجَنَّ مَعَكُمْ وَلَا نُطِيعُ فِيكُمْ أَحَدًا أَبَدًا وَإِن قُوتِلْتُمْ لَنَنصُرَنَّكُمْ وَٱللَّهُ يَشْهَدُ إِنَّهُمْ لَكَـٰذِبُونَ,"Apakah kamu tidak memperhatikan orang-orang yang munafik yang berkata kepada saudara-saudara mereka yang kafir di antara ahli kitab, ""Sesungguhnya jika kamu diusir, niscaya kami pun akan keluar bersamamu; dan kami selama-lamanya tidak akan patuh kepada siapa pun untuk (menyusahkan) kamu, dan jika kamu diperangi pasti kami akan membantu kamu"".  Dan Allah menyaksikan bahwa sesungguhnya mereka benar-benar pendusta.","Tidakkah engkau memperhatikan orang-orang munafik yang berkata kepada saudara-saudaranya yang kafir di antara Ahli Kitab, ""Sungguh, jika kamu diusir niscaya kami pun akan keluar bersama kamu; dan kami selama-lamanya tidak akan patuh kepada siapa pun demi kamu, dan jika kamu diperangi pasti kami akan membantumu."" Dan Allah menyaksikan, bahwa mereka benar-benar pendusta.","۞ Apakah Anda tidak melihat kepada mereka yang telah setuju untuk mengatakan kepada saudara -saudara mereka yang tidak percaya dari orang -orang dari orang -orang yang dapat kami taat kepada Anda, dan jika Anda berkata, kami akan mendukung Anda, dan Tuhan akan bersaksi bahwa mereka dibohongi"
12,لَئِنْ أُخْرِجُوا۟ لَا يَخْرُجُونَ مَعَهُمْ وَلَئِن قُوتِلُوا۟ لَا يَنصُرُونَهُمْ وَلَئِن نَّصَرُوهُمْ لَيُوَلُّنَّ ٱلْأَدْبَـٰرَ ثُمَّ لَا يُنصَرُونَ,"Sesungguhnya jika mereka diusir, orang-orang munafik itu tiada akan keluar bersama mereka; dan sesungguhnya jika mereka diperangi, niscaya mereka tiada akan menolongnya; sesungguhnya jika mereka menolongnya, niscaya mereka akan berpaling lari ke belakang, kemudian mereka tidak akan mendapat pertolongan.","Sungguh, jika mereka diusir, orang-orang munafik itu tidak akan keluar bersama mereka, dan jika mereka diperangi; mereka (juga) tidak akan menolongnya; dan kalau pun mereka menolongnya pastilah mereka akan berpaling lari ke belakang, kemudian mereka tidak akan mendapat pertolongan.","Jika mereka keluar, mereka tidak akan keluar dengan mereka, dan jika mereka berkata, mereka tidak akan menang, dan jika kita mendukung mereka, mereka akan bisa"
13,لَأَنتُمْ أَشَدُّ رَهْبَةً فِى صُدُورِهِم مِّنَ ٱللَّهِ ۚ ذَٰلِكَ بِأَنَّهُمْ قَوْمٌ لَّا يَفْقَهُونَ,"Sesungguhnya kamu, dalam hati mereka lebih ditakuti daripada Allah.  Yang demikian itu karena mereka adalah kaum yang tiada mengerti.","Sesungguhnya dalam hati mereka, kamu (muslimin) lebih ditakuti daripada Allah. Yang demikian itu karena mereka orang-orang yang tidak mengerti.",Anda adalah yang paling terintimidasi di payudara mereka daripada Tuhan ۚ yaitu mereka adalah orang -orang yang tidak memahaminya
14,لَا يُقَـٰتِلُونَكُمْ جَمِيعًا إِلَّا فِى قُرًى مُّحَصَّنَةٍ أَوْ مِن وَرَآءِ جُدُرٍۭ ۚ بَأْسُهُم بَيْنَهُمْ شَدِيدٌ ۚ تَحْسَبُهُمْ جَمِيعًا وَقُلُوبُهُمْ شَتَّىٰ ۚ ذَٰلِكَ بِأَنَّهُمْ قَوْمٌ لَّا يَعْقِلُونَ,"Mereka tiada akan memerangi kamu dalam keadaan bersatu padu, kecuali dalam kampung-kampung yang berbenteng atau di balik tembok.  Permusuhan antara sesama mereka adalah sangat hebat.  Kamu kira mereka itu bersatu sedang hati mereka berpecah belah.  Yang demikian itu karena sesungguhnya mereka adalah kaum yang tiada mengerti.","Mereka tidak akan memerangi kamu (secara) bersama-sama, kecuali di negeri-negeri yang berbenteng atau di balik tembok. Permusuhan antara sesama mereka sangat hebat. Kamu kira mereka itu bersatu padahal hati mereka terpecah belah. Yang demikian itu karena mereka orang-orang yang tidak mengerti.",Mereka tidak menyelesaikan Anda semua di desa yang dibenteng
15,كَمَثَلِ ٱلَّذِينَ مِن قَبْلِهِمْ قَرِيبًا ۖ ذَاقُوا۟ وَبَالَ أَمْرِهِمْ وَلَهُمْ عَذَابٌ أَلِيمٌ,(Mereka adalah) seperti orang-orang Yahudi yang belum lama sebelum mereka telah merasai akibat buruk dari perbuatan mereka dan bagi mereka azab yang pedih.,"(Mereka) seperti orang-orang yang sebelum mereka (Yahudi) belum lama berselang, telah merasakan akibat buruk (terusir) disebabkan perbuatan mereka sendiri. Dan mereka akan mendapat azab yang pedih.","Seperti mereka yang dekat dengan mereka, mereka dekat dengan mereka."
16,كَمَثَلِ ٱلشَّيْطَـٰنِ إِذْ قَالَ لِلْإِنسَـٰنِ ٱكْفُرْ فَلَمَّا كَفَرَ قَالَ إِنِّى بَرِىٓءٌ مِّنكَ إِنِّىٓ أَخَافُ ٱللَّهَ رَبَّ ٱلْعَـٰلَمِينَ,"(Bujukan orang-orang munafik itu adalah) seperti (bujukan) setan ketika dia berkata kepada manusia, ""Kafirlah kamu"", maka tatkala manusia itu telah kafir, ia berkata, ""Sesungguhnya aku berlepas diri dari kamu karena sesungguhnya aku takut kepada Allah, Tuhan semesta Alam"".","(Bujukan orang-orang munafik itu) seperti (bujukan) setan ketika ia berkata kepada manusia, ""Kafirlah kamu!"" Kemudian setelah manusia itu menjadi kafir ia berkata, ""Sesungguhnya aku berlepas diri dari kamu, karena sesungguhnya aku takut kepada Allah, Tuhan seluruh alam.""","Seperti orang yang berkata, ketika dia berkata, ketika dia tidak percaya, ketika dia tidak percaya, dia berkata bahwa aku melihat bahwa aku takut pada Tuhan, Tuhan Tuhan"
17,فَكَانَ عَـٰقِبَتَهُمَآ أَنَّهُمَا فِى ٱلنَّارِ خَـٰلِدَيْنِ فِيهَا ۚ وَذَٰلِكَ جَزَٰٓؤُا۟ ٱلظَّـٰلِمِينَ,"Maka adalah kesudahan keduanya bahwa sesungguhnya keduanya (masuk) ke dalam neraka, mereka kekal di dalamnya.  Demikianlah balasan orang-orang yang zalim.","Maka kesudahan bagi keduanya, bahwa keduanya masuk ke dalam neraka, kekal di dalamnya. Demikianlah balasan bagi orang-orang zalim.",Dan mereka mengikuti mereka bahwa mereka berada di dalam api di dalamnya.
18,يَـٰٓأَيُّهَا ٱلَّذِينَ ءَامَنُوا۟ ٱتَّقُوا۟ ٱللَّهَ وَلْتَنظُرْ نَفْسٌ مَّا قَدَّمَتْ لِغَدٍ ۖ وَٱتَّقُوا۟ ٱللَّهَ ۚ إِنَّ ٱللَّهَ خَبِيرٌۢ بِمَا تَعْمَلُونَ,"Hai orang-orang yang beriman, bertakwalah kepada Allah dan hendaklah setiap diri memperhatikan apa yang telah diperbuatnya untuk hari esok (akhirat), dan bertakwalah kepada Allah, sesungguhnya Allah Maha Mengetahui apa yang kamu kerjakan.","Wahai orang-orang yang beriman! Bertakwalah kepada Allah dan hendaklah setiap orang memperhatikan apa yang telah diperbuatnya untuk hari esok (akhirat), dan bertakwalah kepada Allah. Sungguh, Allah Mahateliti terhadap apa yang kamu kerjakan.","O, mereka yang percaya, takut akan Tuhan, dan melihat jiwa dari apa yang telah Anda berikan besok."
19,وَلَا تَكُونُوا۟ كَٱلَّذِينَ نَسُوا۟ ٱللَّهَ فَأَنسَىٰهُمْ أَنفُسَهُمْ ۚ أُو۟لَـٰٓئِكَ هُمُ ٱلْفَـٰسِقُونَ,"Dan janganlah kamu seperti orang-orang yang lupa kepada Allah, lalu Allah menjadikan mereka lupa kepada mereka sendiri.  Mereka itulah orang-orang yang fasik.","Dan janganlah kamu seperti orang-orang yang lupa kepada Allah, sehingga Allah menjadikan mereka lupa akan diri sendiri. Mereka itulah orang-orang fasik.","Dan jangan sama dengan mereka yang melupakan Tuhan, jadi maafkan mereka ۚ atau mereka yang menghalangi"
20,لَا يَسْتَوِىٓ أَصْحَـٰبُ ٱلنَّارِ وَأَصْحَـٰبُ ٱلْجَنَّةِ ۚ أَصْحَـٰبُ ٱلْجَنَّةِ هُمُ ٱلْفَآئِزُونَ,Tidaklah sama penghuni-penghuni neraka dengan penghuni-penghuni surga; penghuni-penghuni surga itulah orang-orang yang beruntung.,Tidak sama para penghuni neraka dengan para penghuni surga; para penghuni surga itulah orang-orang yang memperoleh kemenangan.,Itu tidak sama dengan kebenaran dan koreksi
21,لَوْ أَنزَلْنَا هَـٰذَا ٱلْقُرْءَانَ عَلَىٰ جَبَلٍ لَّرَأَيْتَهُۥ خَـٰشِعًا مُّتَصَدِّعًا مِّنْ خَشْيَةِ ٱللَّهِ ۚ وَتِلْكَ ٱلْأَمْثَـٰلُ نَضْرِبُهَا لِلنَّاسِ لَعَلَّهُمْ يَتَفَكَّرُونَ,"Kalau sekiranya Kami menurunkan Al-Qur`ān ini kepada sebuah gunung, pasti kamu akan melihatnya tunduk terpecah belah disebabkan ketakutannya kepada Allah.  Dan perumpamaan-perumpamaan itu Kami buat untuk manusia supaya mereka berpikir.","Sekiranya Kami turunkan Alquran ini kepada sebuah gunung, pasti kamu akan melihatnya tunduk terpecah belah disebabkan takut kepada Allah. Dan perumpamaan-perumpamaan itu Kami buat untuk manusia agar mereka berpikir.","Jika kami datang kepada kami, mereka adalah pembaca di gunung, saya akan melihatnya, dan itu adalah kebenaran dari ketakutan yang mungkin mereka pikirkan"
22,هُوَ ٱللَّهُ ٱلَّذِى لَآ إِلَـٰهَ إِلَّا هُوَ ۖ عَـٰلِمُ ٱلْغَيْبِ وَٱلشَّهَـٰدَةِ ۖ هُوَ ٱلرَّحْمَـٰنُ ٱلرَّحِيمُ,"Dia-lah Allah Yang tiada Tuhan (yang berhak disembah) selain Dia, Yang Mengetahui yang gaib dan yang nyata, Dia-lah Yang Maha Pemurah lagi Maha Penyayang.","Dialah Allah, tidak ada tuhan selain Dia. Mengetahui yang gaib dan yang nyata, Dialah Yang Maha Pengasih, Maha Penyayang.",Dia adalah Tuhan yang bukan Tuhan kecuali Dia 😂 “poni dan penampilannya
23,هُوَ ٱللَّهُ ٱلَّذِى لَآ إِلَـٰهَ إِلَّا هُوَ ٱلْمَلِكُ ٱلْقُدُّوسُ ٱلسَّلَـٰمُ ٱلْمُؤْمِنُ ٱلْمُهَيْمِنُ ٱلْعَزِيزُ ٱلْجَبَّارُ ٱلْمُتَكَبِّرُ ۚ سُبْحَـٰنَ ٱللَّهِ عَمَّا يُشْرِكُونَ,"Dia-lah Allah Yang tiada Tuhan (yang berhak disembah) selain Dia, Raja, Yang Maha Suci, Yang Maha Sejahtera, Yang Mengaruniakan Keamanan, Yang Maha Memelihara, Yang Maha Perkasa, Yang Maha Kuasa, Yang Memiliki Segala Keagungan, Maha Suci Allah dari apa yang mereka persekutukan.","Dialah Allah, tidak ada tuhan selain Dia. Maha Raja Yang Mahasuci, Yang Mahasejahtera, Yang Menjaga Keamanan, Pemelihara Keselamatan, Yang Mahaperkasa, Yang Mahakuasa, Yang Memiliki Segala Keagungan. Mahasuci Allah dari apa yang mereka persekutukan.","Dia adalah orang yang adalah Tuhan, tetapi Dia adalah Tuhan, Tuhan, yang buta dari Allah pujian bagi Tuhan"
24,هُوَ ٱللَّهُ ٱلْخَـٰلِقُ ٱلْبَارِئُ ٱلْمُصَوِّرُ ۖ لَهُ ٱلْأَسْمَآءُ ٱلْحُسْنَىٰ ۚ يُسَبِّحُ لَهُۥ مَا فِى ٱلسَّمَـٰوَٰتِ وَٱلْأَرْضِ ۖ وَهُوَ ٱلْعَزِيزُ ٱلْحَكِيمُ,"Dia-lah Allah Yang Menciptakan, Yang Mengadakan, Yang Membentuk Rupa, Yang Mempunyai nama-nama yang paling baik. Bertasbih kepada-Nya apa yang di langit dan di bumi. Dan Dia-lah Yang Maha Perkasa lagi Maha Bijaksana.","Dialah Allah Yang Menciptakan, Yang Mengadakan, Yang Membentuk Rupa, Dia memiliki nama-nama yang indah. Apa yang di langit dan di bumi bertasbih kepada-Nya. Dan Dialah Yang Mahaperkasa, Mahabijaksana.","Dia adalah kepala balap, kepala doa. Dear Is The Wise"
