verse_number,arab,king_fahd,kemenag,google_translate
1, إِنَّا فَتَحْنَا لَكَ فَتْحًا مُّبِينًا,"Sesungguhnya Kami telah memberikan kepadamu kemenangan yang nyata,","Sungguh, Kami telah memberikan kepadamu kemenangan yang nyata.",Kami membuka untuk Anda
2,لِّيَغْفِرَ لَكَ ٱللَّهُ مَا تَقَدَّمَ مِن ذَنۢبِكَ وَمَا تَأَخَّرَ وَيُتِمَّ نِعْمَتَهُۥ عَلَيْكَ وَيَهْدِيَكَ صِرَٰطًا مُّسْتَقِيمًا,"supaya Allah memberi ampunan kepadamu terhadap dosamu yang telah lalu dan yang akan datang serta menyempurnakan nikmat-Nya atasmu dan memimpin kamu kepada jalan yang lurus,","Agar Allah memberikan ampunan kepadamu (Muhammad) atas dosamu yang lalu dan yang akan datang, serta menyempurnakan nikmat-Nya atasmu dan menunjukimu ke jalan yang lurus,","Semoga Tuhan mengampuni Anda, apa yang Anda tawarkan berasal dari dosa Anda, dan apa yang Anda tunda, dan berkat -Nya dipenuhi pada Anda dan membimbing Anda."
3,وَيَنصُرَكَ ٱللَّهُ نَصْرًا عَزِيزًا,dan supaya Allah menolongmu dengan pertolongan yang kuat (banyak).,dan agar Allah menolongmu dengan pertolongan yang kuat (banyak).,"Dan Tuhan memberkati Anda, kemenangan sayang"
4,هُوَ ٱلَّذِىٓ أَنزَلَ ٱلسَّكِينَةَ فِى قُلُوبِ ٱلْمُؤْمِنِينَ لِيَزْدَادُوٓا۟ إِيمَـٰنًا مَّعَ إِيمَـٰنِهِمْ ۗ وَلِلَّهِ جُنُودُ ٱلسَّمَـٰوَٰتِ وَٱلْأَرْضِ ۚ وَكَانَ ٱللَّهُ عَلِيمًا حَكِيمًا,"Dia-lah yang telah menurunkan ketenangan ke dalam hati orang-orang mukmin supaya keimanan mereka bertambah di samping keimanan mereka (yang telah ada).  Dan kepunyaan Allah-lah tentara langit dan bumi dan adalah Allah Maha Mengetahui lagi Maha Bijaksana, ","Dialah yang telah menurunkan ketenangan ke dalam hati orang-orang mukmin untuk menambah keimanan atas keimanan mereka (yang telah ada). Dan milik Allah lah bala tentara langit dan bumi, dan Allah Maha Mengetahui, Mahabijaksana,",Orang yang telah diturunkan dari hati orang -orang percaya untuk meningkatkan eman dan Tuhan adalah pengetahuan yang bijak
5,لِّيُدْخِلَ ٱلْمُؤْمِنِينَ وَٱلْمُؤْمِنَـٰتِ جَنَّـٰتٍ تَجْرِى مِن تَحْتِهَا ٱلْأَنْهَـٰرُ خَـٰلِدِينَ فِيهَا وَيُكَفِّرَ عَنْهُمْ سَيِّـَٔاتِهِمْ ۚ وَكَانَ ذَٰلِكَ عِندَ ٱللَّهِ فَوْزًا عَظِيمًا,"supaya Dia memasukkan orang-orang mukmin laki-laki dan perempuan ke dalam surga yang mengalir di bawahnya sungai-sungai, mereka kekal di dalamnya dan supaya Dia menutupi kesalahan-kesalahan mereka.  Dan yang demikian itu adalah keberuntungan yang besar di sisi Allah,","Agar Dia masukkan orang-orang mukmin laki-laki dan perempuan ke dalam surga yang mengalir di bawahnya sungai-sungai. Mereka kekal di dalamnya dan Dia akan menghapus kesalahan-kesalahan mereka. Dan yang demikian itu menurut Allah suatu keuntungan yang besar,",Biarkan orang -orang percaya dan orang -orang percaya memasuki surga yang mengalir dari bawahnya ketika Tuhan itu hebat
6,وَيُعَذِّبَ ٱلْمُنَـٰفِقِينَ وَٱلْمُنَـٰفِقَـٰتِ وَٱلْمُشْرِكِينَ وَٱلْمُشْرِكَـٰتِ ٱلظَّآنِّينَ بِٱللَّهِ ظَنَّ ٱلسَّوْءِ ۚ عَلَيْهِمْ دَآئِرَةُ ٱلسَّوْءِ ۖ وَغَضِبَ ٱللَّهُ عَلَيْهِمْ وَلَعَنَهُمْ وَأَعَدَّ لَهُمْ جَهَنَّمَ ۖ وَسَآءَتْ مَصِيرًا,dan supaya Dia mengazab orang-orang munafik laki-laki dan perempuan dan orang-orang musyrik laki-laki dan perempuan yang mereka itu berprasangka buruk terhadap Allah.  Mereka akan mendapat giliran (kebinasaan) yang amat buruk dan Allah memurkai dan mengutuk mereka serta menyediakan bagi mereka neraka Jahanam.  Dan (neraka Jahanam) itulah sejahat-jahat tempat kembali.,"dan Dia mengazab orang-orang munafik laki-laki dan perempuan, dan (juga) orang-orang musyrik laki-laki dan perempuan yang berprasangka buruk terhadap Allah. Mereka akan mendapat giliran (azab) yang buruk, dan Allah murka kepada mereka dan mengutuk mereka, serta menyediakan neraka Jahanam bagi mereka. Dan (neraka Jahanam) itu seburuk-buruk tempat kembali.","Dan menyiksa orang -orang, orang -orang yang terpisah, mitra, pasangan, dan pasangan, umat Allah, umat Allah. Dan Tuhan marah kepada mereka dan mengutuk mereka, dan Dia mempersiapkan mereka neraka."
7,وَلِلَّهِ جُنُودُ ٱلسَّمَـٰوَٰتِ وَٱلْأَرْضِ ۚ وَكَانَ ٱللَّهُ عَزِيزًا حَكِيمًا,Dan kepunyaan Allah-lah tentara langit dan bumi.  Dan adalah Allah Maha Perkasa lagi Maha Bijaksana.,"Dan milik Allah bala tentara langit dan bumi. Dan Allah Mahaperkasa, Mahabijaksana.",Dan kepada Tuhan para prajurit langit dan bumi ۚ dan Tuhan sangat bijak
8,إِنَّآ أَرْسَلْنَـٰكَ شَـٰهِدًا وَمُبَشِّرًا وَنَذِيرًا,"Sesungguhnya Kami mengutus kamu sebagai saksi, pembawa berita gembira, dan pemberi peringatan,","Sungguh, Kami mengutus engkau (Muhammad) sebagai saksi, pembawa berita gembira dan pemberi peringatan,","Saya mengirimkan kesengsaraan, khotbah dan peringatan"
9,لِّتُؤْمِنُوا۟ بِٱللَّهِ وَرَسُولِهِۦ وَتُعَزِّرُوهُ وَتُوَقِّرُوهُ وَتُسَبِّحُوهُ بُكْرَةً وَأَصِيلًا,"supaya kamu sekalian beriman kepada Allah dan rasul-Nya, menguatkan (agama)-Nya, membesarkan-Nya, dan bertasbih kepada-Nya di waktu pagi dan petang.","agar kamu semua beriman kepada Allah dan Rasul-Nya, menguatkan (agama)-Nya, membesarkan-Nya, dan bertasbih kepada-Nya pagi dan petang.",Biarkan mereka percaya pada Tuhan dan utusan -Nya
10,إِنَّ ٱلَّذِينَ يُبَايِعُونَكَ إِنَّمَا يُبَايِعُونَ ٱللَّهَ يَدُ ٱللَّهِ فَوْقَ أَيْدِيهِمْ ۚ فَمَن نَّكَثَ فَإِنَّمَا يَنكُثُ عَلَىٰ نَفْسِهِۦ ۖ وَمَنْ أَوْفَىٰ بِمَا عَـٰهَدَ عَلَيْهُ ٱللَّهَ فَسَيُؤْتِيهِ أَجْرًا عَظِيمًا,"Bahwasanya orang-orang yang berjanji setia kepada kamu sesungguhnya mereka berjanji setia kepada Allah.  Tangan Allah di atas tangan mereka, maka barang siapa yang melanggar janjinya, niscaya akibat ia melanggar janji itu akan menimpa dirinya sendiri dan barang siapa menepati janjinya kepada Allah maka Allah akan memberinya pahala yang besar.","Bahwa orang-orang yang berjanji setia kepadamu (Muhammad), sesungguhnya mereka hanya berjanji setia kepada Allah. Tangan Allah di atas tangan-tangan mereka, maka barangsiapa melanggar janji, maka sesungguhnya dia melanggar atas (janji) sendiri; dan barangsiapa menepati janjinya kepada Allah, maka Dia akan memberinya pahala yang besar.","Bagi mereka yang menjual Anda, tetapi mereka menjual Tuhan, tangan Tuhan, dan menurut tangan mereka ۚ jadi siapa pun yang tinggal, maka ia akan berakhir. Semoga Tuhan memberkatinya dan memberinya hadiah besar"
11,سَيَقُولُ لَكَ ٱلْمُخَلَّفُونَ مِنَ ٱلْأَعْرَابِ شَغَلَتْنَآ أَمْوَٰلُنَا وَأَهْلُونَا فَٱسْتَغْفِرْ لَنَا ۚ يَقُولُونَ بِأَلْسِنَتِهِم مَّا لَيْسَ فِى قُلُوبِهِمْ ۚ قُلْ فَمَن يَمْلِكُ لَكُم مِّنَ ٱللَّهِ شَيْـًٔا إِنْ أَرَادَ بِكُمْ ضَرًّا أَوْ أَرَادَ بِكُمْ نَفْعًۢا ۚ بَلْ كَانَ ٱللَّهُ بِمَا تَعْمَلُونَ خَبِيرًۢا,"Orang-orang Badui yang tertinggal (tidak turut ke ῌudaybiyyah) akan mengatakan, ""Harta dan keluarga kami telah merintangi kami, maka mohonkanlah ampunan untuk kami""; mereka mengucapkan dengan lidahnya apa yang tidak ada dalam hatinya.  Katakanlah, ""Maka siapakah (gerangan) yang dapat menghalang-halangi kehendak Allah jika Dia menghendaki kemudaratan bagimu atau jika Dia menghendaki manfaat bagimu.  Sebenarnya Allah Maha Mengetahui apa yang kamu kerjakan.","Orang-orang Badui yang tertinggal (tidak turut ke Hudaibiyah) akan berkata kepadamu, ""Kami telah disibukkan oleh harta dan keluarga kami, maka mohonkanlah ampunan untuk kami."" Mereka mengucapkan sesuatu dengan mulutnya apa yang tidak ada dalam hatinya. Katakanlah, ""Maka siapakah yang dapat menghalang-halangi kehendak Allah jika Dia menghendaki bencana terhadap kamu atau jika Dia menghendaki keuntungan bagimu? Sungguh, Allah Mahateliti dengan apa yang kamu kerjakan.""","Mereka akan memberi tahu Anda siapa penerus orang -orang Arab, kami telah bekerja sebagai ibu kami dan orang -orang kami, jadi cari pengampunan bagi kami ۚ Mereka mengatakan: ۚ Katakan: Siapa pun yang memiliki Anda dari Tuhan, sesuatu, jika dia ingin menyakiti Anda atau ingin Anda mendapat manfaat dari Anda."
12,بَلْ ظَنَنتُمْ أَن لَّن يَنقَلِبَ ٱلرَّسُولُ وَٱلْمُؤْمِنُونَ إِلَىٰٓ أَهْلِيهِمْ أَبَدًا وَزُيِّنَ ذَٰلِكَ فِى قُلُوبِكُمْ وَظَنَنتُمْ ظَنَّ ٱلسَّوْءِ وَكُنتُمْ قَوْمًۢا بُورًا,"Tetapi kamu menyangka bahwa rasul dan orang-orang mukmin tidak sekali-kali akan kembali kepada keluarga mereka selama-lamanya dan setan telah menjadikan kamu memandang baik dalam hatimu persangkaan itu, dan kamu telah menyangka dengan sangkaan yang buruk dan kamu menjadi kaum yang binasa.","Bahkan (semula) kamu menyangka bahwa Rasul dan orang-orang mukmin sekali-kali tidak akan kembali lagi kepada keluarga mereka selama-lamanya, dan dijadikan terasa indah yang demikian itu di dalam hatimu, dan kamu telah berprasangka dengan prasangka yang buruk, karena itu kamu menjadi kaum yang binasa.","Sebaliknya, Anda berpikir bahwa utusan dan orang -orang percaya tidak akan beralih ke umat Allah selamanya dan menghiasnya di dalam hati Anda, dan Anda telah memikirkan Anda tentang Anda"
13,وَمَن لَّمْ يُؤْمِنۢ بِٱللَّهِ وَرَسُولِهِۦ فَإِنَّآ أَعْتَدْنَا لِلْكَـٰفِرِينَ سَعِيرًا,"Dan barang siapa yang tidak beriman kepada Allah dan rasul-Nya, maka sesungguhnya Kami menyediakan untuk orang-orang yang kafir neraka yang menyala-nyala.","Dan barangsiapa tidak beriman kepada Allah dan Rasul-Nya, maka sesungguhnya Kami telah menyediakan untuk orang-orang kafir itu neraka yang menyala-nyala.",Dan siapa pun yang tidak percaya pada Tuhan dan utusan -Nya
14,وَلِلَّهِ مُلْكُ ٱلسَّمَـٰوَٰتِ وَٱلْأَرْضِ ۚ يَغْفِرُ لِمَن يَشَآءُ وَيُعَذِّبُ مَن يَشَآءُ ۚ وَكَانَ ٱللَّهُ غَفُورًا رَّحِيمًا,Dan hanya kepunyaan Allah-lah kerajaan langit dan bumi.  Dia memberikan ampun kepada siapa yang dikehendaki-Nya dan mengazab siapa yang dikehendaki-Nya.  Dan Allah Maha Pengampun lagi Maha Penyayang.,"Dan hanya milik Allah kerajaan langit dan bumi. Dia mengampuni siapa yang Dia kehendaki, dan akan mengazab siapa yang Dia kehendaki. Dan Allah Maha Pengampun, Maha Penyayang.","Dan kepada Tuhan, Raja Surga dan Bumi ۚ Dia mengampuni orang -orang yang mau dan menyiksa siapa pun yang kehendak ۚ dan Tuhan diampuni, penuh belas kasihan"
15,سَيَقُولُ ٱلْمُخَلَّفُونَ إِذَا ٱنطَلَقْتُمْ إِلَىٰ مَغَانِمَ لِتَأْخُذُوهَا ذَرُونَا نَتَّبِعْكُمْ ۖ يُرِيدُونَ أَن يُبَدِّلُوا۟ كَلَـٰمَ ٱللَّهِ ۚ قُل لَّن تَتَّبِعُونَا كَذَٰلِكُمْ قَالَ ٱللَّهُ مِن قَبْلُ ۖ فَسَيَقُولُونَ بَلْ تَحْسُدُونَنَا ۚ بَلْ كَانُوا۟ لَا يَفْقَهُونَ إِلَّا قَلِيلًا,"Orang-orang Badui yang tertinggal itu akan berkata apabila kamu berangkat untuk mengambil barang rampasan, ""Biarkanlah kami, niscaya kami mengikuti kamu; mereka hendak merubah janji Allah.  Katakanlah, ""Kamu sekali-kali tidak (boleh) mengikuti kami; demikian Allah telah menetapkan sebelumnya""; mereka akan mengatakan, ""Sebenarnya kamu dengki kepada kami"".  Bahkan mereka tidak mengerti melainkan sedikit sekali.","Apabila kamu berangkat untuk mengambil barang rampasan, orang-orang Badui yang tertinggal itu akan berkata, ""Biarkanlah kami mengikuti kamu."" Mereka hendak mengubah janji Allah. Katakanlah, ""Kamu sekali-kali tidak (boleh) mengikuti kami. Demikianlah yang telah ditetapkan Allah sejak semula."" Maka mereka akan berkata, ""Sebenarnya kamu dengki kepada kami."" Padahal mereka tidak mengerti melainkan sedikit sekali.","Mereka akan mengatakan bahwa ketika Anda dibebaskan, Anda akan diberikan kepada seorang pria, sehingga mereka akan membawanya kepada Anda. Kami akan mengikuti Anda. Anda mengikuti kami, seperti yang Tuhan katakan, sebelum Anda akan berkata, tetapi Anda akan iri."
16,قُل لِّلْمُخَلَّفِينَ مِنَ ٱلْأَعْرَابِ سَتُدْعَوْنَ إِلَىٰ قَوْمٍ أُو۟لِى بَأْسٍ شَدِيدٍ تُقَـٰتِلُونَهُمْ أَوْ يُسْلِمُونَ ۖ فَإِن تُطِيعُوا۟ يُؤْتِكُمُ ٱللَّهُ أَجْرًا حَسَنًا ۖ وَإِن تَتَوَلَّوْا۟ كَمَا تَوَلَّيْتُم مِّن قَبْلُ يُعَذِّبْكُمْ عَذَابًا أَلِيمًا,"Katakanlah kepada orang-orang Badui yang tertinggal, ""Kamu akan diajak untuk (memerangi) kaum yang mempunyai kekuatan yang besar, kamu akan memerangi mereka atau mereka menyerah (masuk Islam).  Maka jika kamu patuhi (ajakan itu), niscaya Allah akan memberikan kepadamu pahala yang baik dan jika kamu berpaling sebagaimana kamu telah berpaling sebelumnya, niscaya Dia akan mengazab kamu dengan azab yang pedih"".","Katakanlah kepada orang-orang Badui yang tertinggal, ""Kamu akan diajak untuk (memerangi) kaum yang mempunyai kekuatan yang besar, kamu harus memerangi mereka kecuali mereka menyerah. Jika kamu patuhi (ajakan itu), Allah akan memberimu pahala yang baik; tetapi jika kamu berpaling seperti yang kamu perbuat sebelumnya, Dia akan mengazab kamu dengan azab yang pedih.""","Katakan kepada mereka yang berada di belakang orang -orang Arab, Anda akan memanggil orang -orang, dan mereka akan menjadi kesulitan yang akan mereka ambil dari mereka, atau mereka akan diberikan kepada Anda, dan mereka akan diberkati. Baik -by - dan jika Anda mengambil alih seperti yang telah Anda selesaikan sebelumnya"
17,لَّيْسَ عَلَى ٱلْأَعْمَىٰ حَرَجٌ وَلَا عَلَى ٱلْأَعْرَجِ حَرَجٌ وَلَا عَلَى ٱلْمَرِيضِ حَرَجٌ ۗ وَمَن يُطِعِ ٱللَّهَ وَرَسُولَهُۥ يُدْخِلْهُ جَنَّـٰتٍ تَجْرِى مِن تَحْتِهَا ٱلْأَنْهَـٰرُ ۖ وَمَن يَتَوَلَّ يُعَذِّبْهُ عَذَابًا أَلِيمًا,"Tiada dosa atas orang-orang yang buta, dan atas orang yang pincang, dan atas orang yang sakit (apabila tidak ikut berperang).  Dan barang siapa yang taat kepada Allah dan rasul-Nya, niscaya Allah akan memasukkannya ke dalam surga yang mengalir di bawahnya sungai-sungai dan barang siapa yang berpaling, niscaya akan diazab-Nya dengan azab yang pedih.","Tidak ada dosa atas orang-orang yang buta, atas orang-orang yang pincang, dan atas orang-orang yang sakit (apabila tidak ikut berperang). Barangsiapa taat kepada Allah dan Rasul-Nya, Dia akan memasukkannya ke dalam surga yang mengalir di bawahnya sungai-sungai; tetapi barangsiapa berpaling, Dia akan mengazabnya dengan azab yang pedih.","Tidak ada yang memalukan pada orang buta, juga tidak memalukan, atau penyakit yang memalukan ۗ dan siapa pun yang mematuhi Tuhan dan Utusan Tuhan المناليال الريل المال dan siapa pun disiksa oleh penyiksaan yang menyakitkan الريل المال dan yang disiksa oleh penyiksaan yang menyakitkan"
18,۞ لَّقَدْ رَضِىَ ٱللَّهُ عَنِ ٱلْمُؤْمِنِينَ إِذْ يُبَايِعُونَكَ تَحْتَ ٱلشَّجَرَةِ فَعَلِمَ مَا فِى قُلُوبِهِمْ فَأَنزَلَ ٱلسَّكِينَةَ عَلَيْهِمْ وَأَثَـٰبَهُمْ فَتْحًا قَرِيبًا,"Sesungguhnya Allah telah rida terhadap orang-orang mukmin ketika mereka berjanji setia kepadamu di bawah pohon, maka Allah mengetahui apa yang ada dalam hati mereka lalu menurunkan ketenangan atas mereka dan memberi balasan kepada mereka dengan kemenangan yang dekat (waktunya).","Sungguh, Allah telah meridai orang-orang mukmin ketika mereka berjanji setia kepadamu (Muhammad) di bawah pohon, Dia mengetahui apa yang ada dalam hati mereka, lalu Dia memberikan ketenangan atas mereka dan memberi balasan dengan kemenangan yang dekat,","۞ Tuhan senang dengan orang -orang percaya, ketika mereka menjual Anda di bawah pohon, jadi dia tahu apa yang ada di hati mereka, jadi dia akan terungkap, jadi dia akan diberkati, dan dia akan datang. hampir"
19,وَمَغَانِمَ كَثِيرَةً يَأْخُذُونَهَا ۗ وَكَانَ ٱللَّهُ عَزِيزًا حَكِيمًا,Serta harta rampasan yang banyak yang dapat mereka ambil.  Dan adalah Allah Maha Perkasa lagi Maha Bijaksana.,"dan harta rampasan perang yang banyak yang akan mereka peroleh. Dan Allah Mahaperkasa, Mahabijaksana.",Dan banyak waktu mereka mengambilnya ۗ dan Tuhan itu sayang dan bijak
20,وَعَدَكُمُ ٱللَّهُ مَغَانِمَ كَثِيرَةً تَأْخُذُونَهَا فَعَجَّلَ لَكُمْ هَـٰذِهِۦ وَكَفَّ أَيْدِىَ ٱلنَّاسِ عَنكُمْ وَلِتَكُونَ ءَايَةً لِّلْمُؤْمِنِينَ وَيَهْدِيَكُمْ صِرَٰطًا مُّسْتَقِيمًا,"Allah menjanjikan kepada kamu harta rampasan yang banyak yang dapat kamu ambil, maka disegerakan-Nya harta rampasan ini untukmu, dan Dia menahan tangan manusia dari (membinasakan)mu (agar kamu mensyukuri-Nya), dan agar hal itu menjadi bukti bagi orang-orang mukmin, dan agar Dia menunjuki kamu kepada jalan yang lurus.","Allah menjanjikan kepadamu harta rampasan perang yang banyak yang dapat kamu ambil, maka Dia segerakan (harta rampasan perang) ini untukmu, dan Dia menahan tangan manusia dari (membinasakan)mu (agar kamu mensyukuri-Nya), dan agar menjadi bukti bagi orang-orang mukmin, dan agar Dia menunjukkan kamu ke jalan yang lurus,",Dan Tuhan menjanjikan banyak jalan lurus
21,وَأُخْرَىٰ لَمْ تَقْدِرُوا۟ عَلَيْهَا قَدْ أَحَاطَ ٱللَّهُ بِهَا ۚ وَكَانَ ٱللَّهُ عَلَىٰ كُلِّ شَىْءٍ قَدِيرًا,Dan (telah menjanjikan pula kemenangan-kemenangan) yang lain (atas negeri-negeri) yang kamu belum dapat menguasainya yang sungguh Allah telah menentukan-Nya.  Dan adalah Allah Maha Kuasa atas segala sesuatu.,"dan (kemenangan-kemenangan) atas negeri-negeri lain yang tidak dapat kamu perkirakan, tetapi sesungguhnya Allah telah menentukannya. Dan Allah Mahakuasa atas segala sesuatu.","Dan yang lain tidak menghargainya, Tuhan telah mengelilinginya."
22,وَلَوْ قَـٰتَلَكُمُ ٱلَّذِينَ كَفَرُوا۟ لَوَلَّوُا۟ ٱلْأَدْبَـٰرَ ثُمَّ لَا يَجِدُونَ وَلِيًّا وَلَا نَصِيرًا,Dan sekiranya orang-orang kafir itu memerangi kamu pastilah mereka berbalik melarikan diri ke belakang (kalah) kemudian mereka tiada memperoleh pelindung dan tidak (pula) menolong.,"Dan sekiranya orang-orang yang kafir itu memerangi kamu, pastilah mereka akan berbalik melarikan diri (kalah), dan mereka tidak akan mendapatkan pelindung dan penolong.","Dan jika mereka yang tidak percaya Anda, mereka akan tidak percaya Anda."
23,سُنَّةَ ٱللَّهِ ٱلَّتِى قَدْ خَلَتْ مِن قَبْلُ ۖ وَلَن تَجِدَ لِسُنَّةِ ٱللَّهِ تَبْدِيلًا,"Sebagai suatu sunatullah yang telah berlaku sejak dahulu, kamu sekali-kali tiada akan menemukan perubahan bagi sunatullah itu.","(Demikianlah) hukum Allah yang telah berlaku sejak dahulu, kamu sekali-kali tidak akan menemukan perubahan pada hukum Allah.","Sunnah Allah, yang telah diberikan sebelumnya."
24,وَهُوَ ٱلَّذِى كَفَّ أَيْدِيَهُمْ عَنكُمْ وَأَيْدِيَكُمْ عَنْهُم بِبَطْنِ مَكَّةَ مِنۢ بَعْدِ أَنْ أَظْفَرَكُمْ عَلَيْهِمْ ۚ وَكَانَ ٱللَّهُ بِمَا تَعْمَلُونَ بَصِيرًا,"Dan Dia-lah yang menahan tangan mereka dari (membinasakan) kamu dan (menahan) tangan kamu dari (membinasakan) mereka di tengah kota Mekah sesudah Allah memenangkan kamu atas mereka, dan adalah Allah Maha Melihat apa yang kamu kerjakan.","Dan Dialah yang mencegah tangan mereka dari (membinasakan) kamu dan (mencegah) tangan kamu dari (membinasakan) mereka di tengah (kota) Mekkah, setelah Allah memenangkan kamu atas mereka. Dan Allah Maha Melihat apa yang kamu kerjakan.","Dan itu adalah orang yang menghentikan tangan mereka dari Anda dan tangan Anda dari mereka dengan kekuatan Mekah, setelah itu saya akan meledakkan Anda kepada mereka."
25,هُمُ ٱلَّذِينَ كَفَرُوا۟ وَصَدُّوكُمْ عَنِ ٱلْمَسْجِدِ ٱلْحَرَامِ وَٱلْهَدْىَ مَعْكُوفًا أَن يَبْلُغَ مَحِلَّهُۥ ۚ وَلَوْلَا رِجَالٌ مُّؤْمِنُونَ وَنِسَآءٌ مُّؤْمِنَـٰتٌ لَّمْ تَعْلَمُوهُمْ أَن تَطَـُٔوهُمْ فَتُصِيبَكُم مِّنْهُم مَّعَرَّةٌۢ بِغَيْرِ عِلْمٍ ۖ لِّيُدْخِلَ ٱللَّهُ فِى رَحْمَتِهِۦ مَن يَشَآءُ ۚ لَوْ تَزَيَّلُوا۟ لَعَذَّبْنَا ٱلَّذِينَ كَفَرُوا۟ مِنْهُمْ عَذَابًا أَلِيمًا,"Merekalah orang-orang yang kafir yang menghalangi kamu dari (masuk) Masjidil Haram dan menghalangi hewan kurban sampai ke tempat (penyembelihan)nya.  Dan kalau tidaklah karena laki-laki yang mukmin dan perempuan-perempuan yang mukmin yang tiada kamu ketahui, bahwa kamu akan membunuh mereka yang menyebabkan kamu ditimpa kesusahan tanpa pengetahuanmu (tentulah Allah tidak akan menahan tanganmu dari membinasakan mereka).  Supaya Allah memasukkan siapa yang dikehendaki-Nya ke dalam rahmat-Nya.  Sekiranya mereka tidak bercampur-baur, tentulah Kami akan mengazab orang-orang yag kafir di antara mereka dengan azab yang pedih.","Merekalah orang-orang kafir yang menghalang-halangi kamu (masuk) Masjidilharam dan menghambat hewan-hewan kurban sampai ke tempat (penyembelihan)nya. Dan kalau bukanlah karena ada beberapa orang beriman laki-laki dan perempuan yang tidak kamu ketahui, tentulah kamu akan membunuh mereka yang menyebabkan kamu ditimpa kesulitan tanpa kamu sadari; karena Allah hendak memasukkan siapa yang Dia kehendaki ke dalam rahmat-Nya. Sekiranya mereka terpisah, tentu Kami akan mengazab orang-orang yang kafir di antara mereka dengan azab yang pedih.","Mereka adalah orang -orang yang tidak percaya, dan mereka akan mengusir Anda dari masjid, yang terlarang, dan bimbingannya ada dengan Anda, untuk mencapai tempat yang beriman, dan Anda tidak mengajar mereka untuk memberi mereka, dan Anda akan menimpa Anda dari mereka, tanpa sepengetahuan mereka. Kami disiksa oleh mereka yang tidak percaya dari mereka dengan siksaan besar"
26,إِذْ جَعَلَ ٱلَّذِينَ كَفَرُوا۟ فِى قُلُوبِهِمُ ٱلْحَمِيَّةَ حَمِيَّةَ ٱلْجَـٰهِلِيَّةِ فَأَنزَلَ ٱللَّهُ سَكِينَتَهُۥ عَلَىٰ رَسُولِهِۦ وَعَلَى ٱلْمُؤْمِنِينَ وَأَلْزَمَهُمْ كَلِمَةَ ٱلتَّقْوَىٰ وَكَانُوٓا۟ أَحَقَّ بِهَا وَأَهْلَهَا ۚ وَكَانَ ٱللَّهُ بِكُلِّ شَىْءٍ عَلِيمًا,"Ketika orang-orang kafir menanamkan dalam hati mereka kesombongan, (yaitu) kesombongan jahiliah lalu Allah menurunkan ketenangan kepada rasul-Nya, dan kepada orang-orang mukmin dan Allah mewajibkan kepada mereka kalimat takwa dan adalah mereka berhak dengan kalimat takwa itu dan patut memilikinya.  Dan adalah Allah Maha Mengetahui segala sesuatu.","Ketika orang-orang yang kafir menanamkan kesombongan dalam hati mereka (yaitu) kesombongan jahiliah, maka Allah menurunkan ketenangan kepada Rasul-Nya, dan kepada orang-orang mukmin dan (Allah) mewajibkan kepada mereka tetap taat menjalankan kalimat takwa, dan mereka lebih berhak dengan itu dan patut memilikinya. Dan Allah Maha Mengetahui segala sesuatu.","Ketika mereka yang tidak percaya dalam hati mereka membuat demam demam demam lava, jadi Tuhan mengungkapkan air matanya pada otoritas Allah dan kewajiban mereka adalah firman kesalehan, dan mereka lebih benar untuk itu dan umat -umatnya ۚ dan Tuhan semuanya berpengetahuan luas"
