verse_number,arab,king_fahd,kemenag,google_translate
1, يَـٰٓأَيُّهَا ٱلَّذِينَ ءَامَنُوا۟ لَا تَتَّخِذُوا۟ عَدُوِّى وَعَدُوَّكُمْ أَوْلِيَآءَ تُلْقُونَ إِلَيْهِم بِٱلْمَوَدَّةِ وَقَدْ كَفَرُوا۟ بِمَا جَآءَكُم مِّنَ ٱلْحَقِّ يُخْرِجُونَ ٱلرَّسُولَ وَإِيَّاكُمْ ۙ أَن تُؤْمِنُوا۟ بِٱللَّهِ رَبِّكُمْ إِن كُنتُمْ خَرَجْتُمْ جِهَـٰدًا فِى سَبِيلِى وَٱبْتِغَآءَ مَرْضَاتِى ۚ تُسِرُّونَ إِلَيْهِم بِٱلْمَوَدَّةِ وَأَنَا۠ أَعْلَمُ بِمَآ أَخْفَيْتُمْ وَمَآ أَعْلَنتُمْ ۚ وَمَن يَفْعَلْهُ مِنكُمْ فَقَدْ ضَلَّ سَوَآءَ ٱلسَّبِيلِ,"Hai orang-orang yang beriman, janganlah kamu mengambil musuh-Ku dan musuhmu menjadi teman-teman setia yang kamu sampaikan kepada mereka (berita-berita Muhammad), karena rasa kasih sayang; padahal sesungguhnya mereka telah ingkar kepada kebenaran yang datang kepadamu, mereka mengusir rasul dan (mengusir) kamu karena kamu beriman kepada Allah, Tuhan-mu.  Jika kamu benar-benar keluar untuk berjihad di jalan-Ku dan mencari keridaan-Ku (janganlah kamu berbuat demikian).  Kamu memberitahukan secara rahasia (berita-berita Muhammad) kepada mereka, karena rasa kasih sayang.  Aku lebih mengetahui apa yang kamu sembunyikan dan apa yang kamu nyatakan.  Dan barang siapa di antara kamu yang melakukannya, maka sesungguhnya dia telah tersesat dari jalan yang lurus.","Wahai orang-orang yang beriman! Janganlah kamu menjadikan musuh-Ku dan musuhmu sebagai teman-teman setia sehingga kamu sampaikan kepada mereka (berita-berita Muhammad), karena rasa kasih sayang; padahal mereka telah ingkar kepada kebenaran yang disampaikan kepadamu. Mereka mengusir Rasul dan kamu sendiri karena kamu beriman kepada Allah, Tuhanmu. Jika kamu benar-benar keluar untuk berjihad pada jalan-Ku dan mencari keridaan-Ku (janganlah kamu berbuat demikian). Kamu memberitahukan secara rahasia (berita-berita Muhammad) kepada mereka, karena rasa kasih sayang, dan Aku lebih mengetahui apa yang kamu sembunyikan dan apa yang kamu nyatakan. Dan barangsiapa di antara kamu yang melakukannya, maka sungguh dia telah tersesat dari jalan yang lurus.","O, mereka yang percaya, jangan mengambil musuh saya dan musuh Anda adalah prioritas, mereka keluar dari utusan dan dengan Anda ۙ untuk percaya kepada Tuhan, Tuhan Anda, jika Anda telah keluar di jalan saya dan mencari kesenangan dari penyakit. Dan saya tahu apa yang telah Anda sembunyikan dan apa yang saya nyatakan ۚ dan siapa pun yang melakukannya dari Anda telah tersesat."
2,إِن يَثْقَفُوكُمْ يَكُونُوا۟ لَكُمْ أَعْدَآءً وَيَبْسُطُوٓا۟ إِلَيْكُمْ أَيْدِيَهُمْ وَأَلْسِنَتَهُم بِٱلسُّوٓءِ وَوَدُّوا۟ لَوْ تَكْفُرُونَ,"Jika mereka menangkap kamu, niscaya mereka bertindak sebagai musuh bagimu dan melepaskan tangan dan lidah mereka kepadamu dengan menyakiti(mu); dan mereka ingin supaya kamu (kembali) kafir.","Jika mereka menangkapmu, niscaya mereka bertindak sebagai musuh bagimu lalu melepaskan tangan dan lidahnya kepadamu untuk menyakiti dan mereka ingin agar kamu (kembali) kafir.","Jika mereka akan mendukung Anda, Anda akan banyak, dan mereka akan diberikan kepada Anda kepada Anda dengan tangan dan kesengsaraan mereka dengan hal yang sama"
3,لَن تَنفَعَكُمْ أَرْحَامُكُمْ وَلَآ أَوْلَـٰدُكُمْ ۚ يَوْمَ ٱلْقِيَـٰمَةِ يَفْصِلُ بَيْنَكُمْ ۚ وَٱللَّهُ بِمَا تَعْمَلُونَ بَصِيرٌ,Karib kerabat dan anak-anakmu sekali-sekali tiada bermanfaat bagimu pada hari Kiamat.  Dia akan memisahkan antara kamu.  Dan Allah Maha Melihat apa yang kamu kerjakan.,Kaum kerabatmu dan anak-anakmu tidak akan bermanfaat bagimu pada hari Kiamat. Dia akan memisahkan antara kamu. Dan Allah Maha Melihat apa yang kamu kerjakan.,"Belas kasihan Anda tidak akan menguntungkan Anda, atau anak -anak Anda ۚ pada hari keji"
4,قَدْ كَانَتْ لَكُمْ أُسْوَةٌ حَسَنَةٌ فِىٓ إِبْرَٰهِيمَ وَٱلَّذِينَ مَعَهُۥٓ إِذْ قَالُوا۟ لِقَوْمِهِمْ إِنَّا بُرَءَٰٓؤُا۟ مِنكُمْ وَمِمَّا تَعْبُدُونَ مِن دُونِ ٱللَّهِ كَفَرْنَا بِكُمْ وَبَدَا بَيْنَنَا وَبَيْنَكُمُ ٱلْعَدَٰوَةُ وَٱلْبَغْضَآءُ أَبَدًا حَتَّىٰ تُؤْمِنُوا۟ بِٱللَّهِ وَحْدَهُۥٓ إِلَّا قَوْلَ إِبْرَٰهِيمَ لِأَبِيهِ لَأَسْتَغْفِرَنَّ لَكَ وَمَآ أَمْلِكُ لَكَ مِنَ ٱللَّهِ مِن شَىْءٍ ۖ رَّبَّنَا عَلَيْكَ تَوَكَّلْنَا وَإِلَيْكَ أَنَبْنَا وَإِلَيْكَ ٱلْمَصِيرُ,"Sesungguhnya telah ada suri teladan yang baik bagimu pada Ibrāhīm dan orang-orang yang bersama dengan dia; ketika mereka berkata kepada kaum mereka, ""Sesungguhnya kami berlepas diri dari kamu dari dari apa yang kamu sembah selain Allah, kami ingkari (kekafiran)mu dan telah nyata antara kami dan kamu permusuhan dan kebencian buat selama-lamanya sampai kamu beriman kepada Allah saja"".  Kecuali perkataan Ibrāhīm kepada bapaknya, ""Sesungguhnya aku akan memohonkan ampunan bagi kamu dan aku tiada dapat menolak sesuatu pun dari kamu (siksaan) Allah"".  (Ibrāhīm berkata), ""Ya Tuhan kami hanya kepada Engkau-lah kami bertawakal dan hanya kepada Engkau-lah kami bertobat dan hanya kepada Engkau-lah kami kembali,","Sungguh, telah ada suri teladan yang baik bagimu pada Ibrahim dan orang-orang yang bersama dengannya, ketika mereka berkata kepada kaumnya, ""Sesungguhnya kami berlepas diri dari kamu dan dari apa yang kamu sembah selain Allah, kami mengingkari (kekafiran)mu dan telah nyata antara kami dan kamu ada permusuhan dan kebencian buat selama-lamanya sampai kamu beriman kepada Allah saja,"" kecuali perkataan Ibrahim kepada ayahnya, ""Sungguh, aku akan memohonkan ampunan bagimu, namun aku sama sekali tidak dapat menolak (siksaan) Allah terhadapmu."" (Ibrahim berkata), ""Ya Tuhan kami, hanya kepada Engkau kami bertawakal dan hanya kepada Engkau kami bertobat dan hanya kepada Engkaulah kami kembali,","Anda memiliki keturunan yang baik di Abraham dan mereka yang bersamanya ketika mereka berkata kepada orang -orang mereka, tetapi kami berasal dari Anda Tuhan adalah ketidakpercayaan kami kepada Anda dan kami tampak di antara kami dan di antara Anda, saya akan meminta pengampunan untuk Anda, dan apa yang saya miliki untuk Anda dari Tuhan untuk sesuatu."
5,رَبَّنَا لَا تَجْعَلْنَا فِتْنَةً لِّلَّذِينَ كَفَرُوا۟ وَٱغْفِرْ لَنَا رَبَّنَآ ۖ إِنَّكَ أَنتَ ٱلْعَزِيزُ ٱلْحَكِيمُ,"""Ya Tuhan kami, janganlah Engkau jadikan kami (sasaran) fitnah bagi orang-orang kafir.  Dan ampunilah kami ya Tuhan kami.  Sesungguhnya Engkau-lah Yang Maha Perkasa lagi Maha Bijaksana"".","Ya Tuhan kami, janganlah Engkau jadikan kami (sasaran) fitnah bagi orang-orang kafir. Dan ampunilah kami, ya Tuhan kami. Sesungguhnya Engkau Żat Yang Mahaperkasa, Mahabijaksana.""","Tuhan kita tidak menjadikan kita godaan bagi mereka yang tidak percaya dan mengampuni kita, Tuhan kita."
6,لَقَدْ كَانَ لَكُمْ فِيهِمْ أُسْوَةٌ حَسَنَةٌ لِّمَن كَانَ يَرْجُوا۟ ٱللَّهَ وَٱلْيَوْمَ ٱلْـَٔاخِرَ ۚ وَمَن يَتَوَلَّ فَإِنَّ ٱللَّهَ هُوَ ٱلْغَنِىُّ ٱلْحَمِيدُ,"Sesungguhnya pada mereka itu (Ibrāhīm dan umatnya) ada teladan yang baik bagimu; (yaitu) bagi orang-orang yang mengharap (pahala) Allah dan (keselamatan pada) hari kemudian.  Dan barang siapa yang berpaling, maka sesungguhnya Allah Dia-lah yang Maha kaya lagi Maha Terpuji.","Sungguh, pada mereka itu (Ibrahim dan umatnya) terdapat suri teladan yang baik bagimu; (yaitu) bagi orang yang mengharap (pahala) Allah dan (keselamatan pada) hari kemudian, dan barangsiapa berpaling, maka sesungguhnya Allah, Dialah Yang Mahakaya, Maha Terpuji.","Anda memiliki tingkat yang baik untuk Anda yang berharap untuk Tuhan, dan hari itu mewah."
7,۞ عَسَى ٱللَّهُ أَن يَجْعَلَ بَيْنَكُمْ وَبَيْنَ ٱلَّذِينَ عَادَيْتُم مِّنْهُم مَّوَدَّةً ۚ وَٱللَّهُ قَدِيرٌ ۚ وَٱللَّهُ غَفُورٌ رَّحِيمٌ,Mudah-mudahan Allah menimbulkan kasih sayang antaramu dengan orang-orang yang kamu musuhi di antara mereka.  Dan Allah adalah Maha Kuasa.  Dan Allah Maha Pengampun lagi Maha Penyayang.,"Mudah-mudahan Allah menumbuhkan kasih sayang di antara kamu dengan orang-orang yang pernah kamu musuhi di antara mereka. Allah Mahakuasa. Dan Allah Maha Pengampun, Maha Penyayang.","۞ Semoga Tuhan membuatnya membuat di antara Anda dan di antara mereka yang telah digunakan di antara mereka ۚ dan Tuhan adalah takdir ۚ dan Tuhan diampuni, belas kasihan."
8,لَّا يَنْهَىٰكُمُ ٱللَّهُ عَنِ ٱلَّذِينَ لَمْ يُقَـٰتِلُوكُمْ فِى ٱلدِّينِ وَلَمْ يُخْرِجُوكُم مِّن دِيَـٰرِكُمْ أَن تَبَرُّوهُمْ وَتُقْسِطُوٓا۟ إِلَيْهِمْ ۚ إِنَّ ٱللَّهَ يُحِبُّ ٱلْمُقْسِطِينَ,Allah tiada melarang kamu untuk berbuat baik dan berlaku adil terhadap orang-orang yang tiada memerangimu karena agama dan tidak (pula) mengusir kamu dari negerimu.  Sesungguhnya Allah menyukai orang-orang yang berlaku adil.,Allah tidak melarang kamu berbuat baik dan berlaku adil terhadap orang-orang yang tidak memerangimu dalam urusan agama dan tidak mengusir kamu dari kampung halamanmu. Sesungguhnya Allah mencintai orang-orang yang berlaku adil.,"Tuhan tidak melarang Anda dari mereka yang tidak binasa dalam agama, dan mereka tidak membawa Anda keluar dari jalan Anda untuk dibenarkan dan mereka akan diberkati dengan mereka. Keduanya adalah keduanya"
9,إِنَّمَا يَنْهَىٰكُمُ ٱللَّهُ عَنِ ٱلَّذِينَ قَـٰتَلُوكُمْ فِى ٱلدِّينِ وَأَخْرَجُوكُم مِّن دِيَـٰرِكُمْ وَظَـٰهَرُوا۟ عَلَىٰٓ إِخْرَاجِكُمْ أَن تَوَلَّوْهُمْ ۚ وَمَن يَتَوَلَّهُمْ فَأُو۟لَـٰٓئِكَ هُمُ ٱلظَّـٰلِمُونَ,"Sesungguhnya Allah hanya melarang kamu menjadikan sebagai kawanmu orang-orang yang memerangimu karena agama dan mengusir kamu dari negerimu dan membantu (orang lain) untuk mengusirmu.  Dan barang siapa menjadikan mereka sebagai kawan, maka mereka itulah orang-orang yang zalim.","Sesungguhnya Allah hanya melarang kamu menjadikan mereka sebagai kawanmu orang-orang yang memerangi kamu dalam urusan agama dan mengusir kamu dari kampung halamanmu dan membantu (orang lain) untuk mengusirmu. Barangsiapa menjadikan mereka sebagai kawan, mereka itulah orang yang zalim.","Sebaliknya, Tuhan melarang Anda dari orang -orang yang mengizinkan Anda dalam agama dan membawa Anda keluar dari agama Anda, dan membuat Anda bahagia dengan Anda, itu adalah para pria"
10,يَـٰٓأَيُّهَا ٱلَّذِينَ ءَامَنُوٓا۟ إِذَا جَآءَكُمُ ٱلْمُؤْمِنَـٰتُ مُهَـٰجِرَٰتٍ فَٱمْتَحِنُوهُنَّ ۖ ٱللَّهُ أَعْلَمُ بِإِيمَـٰنِهِنَّ ۖ فَإِنْ عَلِمْتُمُوهُنَّ مُؤْمِنَـٰتٍ فَلَا تَرْجِعُوهُنَّ إِلَى ٱلْكُفَّارِ ۖ لَا هُنَّ حِلٌّ لَّهُمْ وَلَا هُمْ يَحِلُّونَ لَهُنَّ ۖ وَءَاتُوهُم مَّآ أَنفَقُوا۟ ۚ وَلَا جُنَاحَ عَلَيْكُمْ أَن تَنكِحُوهُنَّ إِذَآ ءَاتَيْتُمُوهُنَّ أُجُورَهُنَّ ۚ وَلَا تُمْسِكُوا۟ بِعِصَمِ ٱلْكَوَافِرِ وَسْـَٔلُوا۟ مَآ أَنفَقْتُمْ وَلْيَسْـَٔلُوا۟ مَآ أَنفَقُوا۟ ۚ ذَٰلِكُمْ حُكْمُ ٱللَّهِ ۖ يَحْكُمُ بَيْنَكُمْ ۚ وَٱللَّهُ عَلِيمٌ حَكِيمٌ,"Hai orang-orang yang beriman, apabila datang berhijrah kepadamu perempuan-perempuan yang beriman, maka hendaklah kamu uji (keimanan) mereka.  Allah lebih mengetahui tentang keimanan mereka; maka jika kamu telah mengetahui bahwa mereka (benar-benar) beriman maka janganlah kamu kembalikan mereka kepada (suami-suami mereka) orang-orang kafir.  Mereka tiada halal bagi orang-orang kafir itu dan orang-orang kafir itu tiada halal pula bagi mereka.  Dan berikanlah kepada (suami suami) mereka, mahar yang telah mereka bayar.  Dan tiada dosa atasmu mengawini mereka apabila kamu bayar kepada mereka maharnya.  Dan janganlah kamu tetap berpegang pada tali (perkawinan) dengan perempuan-perempuan kafir; dan hendaklah kamu minta mahar yang telah kamu bayar; dan hendaklah mereka meminta mahar yang telah mereka bayar.  Demikianlah hukum Allah yang ditetapkan-Nya di antara kamu.  Dan Allah Maha Mengetahui lagi Maha Bijaksana.","Wahai orang-orang yang beriman! Apabila perempuan-perempuan mukmin datang berhijrah kepadamu, maka hendaklah kamu uji (keimanan) mereka. Allah lebih mengetahui tentang keimanan mereka; jika kamu telah mengetahui bahwa mereka (benar-benar) beriman maka janganlah kamu kembalikan mereka kepada orang-orang kafir (suami-suami mereka). Mereka tidak halal bagi orang-orang kafir itu dan orang-orang kafir itu tidak halal bagi mereka. Dan berikanlah kepada (suami) mereka mahar yang telah mereka berikan. Dan tidak ada dosa bagimu menikahi mereka apabila kamu bayarkan kepada mereka maharnya. Dan janganlah kamu tetap berpegang pada tali (pernikahan) dengan perempuan-perempuan kafir; dan hendaklah kamu minta kembali mahar yang telah kamu berikan; dan (jika suaminya tetap kafir) biarkan mereka meminta kembali mahar yang telah mereka bayarkan (kepada mantan istrinya yang telah beriman). Demikianlah hukum Allah yang ditetapkan-Nya di antara kamu. Dan Allah Maha Mengetahui, Mahabijaksana.","O, Anda yang aman, ketika orang -orang percaya datang kepada Anda, Anda telah mengajari mereka orang percaya, jadi jangan mengembalikannya ke pendamaian. Apakah mereka menikahi mereka, ketika Anda akan senang dengan mereka. Putusan Tuhan 😂 Dia memerintah antara Anda ۚ dan Tuhan adalah pengetahuan yang bijak"
11,وَإِن فَاتَكُمْ شَىْءٌ مِّنْ أَزْوَٰجِكُمْ إِلَى ٱلْكُفَّارِ فَعَاقَبْتُمْ فَـَٔاتُوا۟ ٱلَّذِينَ ذَهَبَتْ أَزْوَٰجُهُم مِّثْلَ مَآ أَنفَقُوا۟ ۚ وَٱتَّقُوا۟ ٱللَّهَ ٱلَّذِىٓ أَنتُم بِهِۦ مُؤْمِنُونَ,"Dan jika seseorang dari istri-istrimu lari kepada orang-orang kafir, lalu kamu mengalahkan mereka, maka bayarkanlah kepada orang-orang yang lari istrinya itu mahar sebanyak yang telah mereka bayar.  Dan bertakwalah kepada Allah Yang kepada-Nya kamu beriman.","Dan jika ada sesuatu (pengembalian mahar) yang belum kamu selesaikan dari istri-istrimu yang lari kepada orang-orang kafir, lalu kamu dapat mengalahkan mereka maka berikanlah (dari harta rampasan) kepada orang-orang yang istrinya lari itu sebanyak mahar yang telah mereka berikan. Dan bertakwalah kamu kepada Allah yang kepada-Nya kamu beriman.","Dan jika Anda memiliki sesuatu dari sayap Anda hingga penebusan, maka Anda menghukum, dan mereka adalah orang -orang yang telah pergi, dan istri mereka seperti, Anda adalah orang percaya"
12,يَـٰٓأَيُّهَا ٱلنَّبِىُّ إِذَا جَآءَكَ ٱلْمُؤْمِنَـٰتُ يُبَايِعْنَكَ عَلَىٰٓ أَن لَّا يُشْرِكْنَ بِٱللَّهِ شَيْـًٔا وَلَا يَسْرِقْنَ وَلَا يَزْنِينَ وَلَا يَقْتُلْنَ أَوْلَـٰدَهُنَّ وَلَا يَأْتِينَ بِبُهْتَـٰنٍ يَفْتَرِينَهُۥ بَيْنَ أَيْدِيهِنَّ وَأَرْجُلِهِنَّ وَلَا يَعْصِينَكَ فِى مَعْرُوفٍ ۙ فَبَايِعْهُنَّ وَٱسْتَغْفِرْ لَهُنَّ ٱللَّهَ ۖ إِنَّ ٱللَّهَ غَفُورٌ رَّحِيمٌ,"Hai Nabi, apabila datang kepadamu perempuan-perempuan yang beriman untuk mengadakan janji setia, bahwa mereka tidak akan mempersekutukan sesuatupun dengan Allah; tidak akan mencuri, tidak akan berzina, tidak akan membunuh anak-anaknya, tidak akan berbuat dusta yang mereka ada-adakan antara tangan dan kaki mereka, dan tidak akan mendurhakaimu dalam urusan yang baik, maka terimalah janji setia mereka dan mohonkanlah ampunan kepada Allah untuk mereka.  Sesungguhnya Allah maha Pengampun lagi Maha Penyayang.","Wahai Nabi! Apabila perempuan-perempuan mukmin datang kepadamu untuk mengadakan baiat (janji setia), bahwa mereka tidak akan mempersekutukan sesuatu apa pun dengan Allah; tidak akan mencuri, tidak akan berzina, tidak akan membunuh anak-anaknya, tidak akan berbuat dusta yang mereka ada-adakan antara tangan dan kaki mereka dan tidak akan mendurhakaimu dalam urusan yang baik, maka terimalah janji setia mereka dan mohonkanlah ampunan untuk mereka kepada Allah. Sungguh, Allah Maha Pengampun, Maha Penyayang.","Oh, Nabi, ketika orang percaya datang kepada Anda memberi mereka, dan jangan datang dengan seorang gadis yang akan hancur di antara mereka dan kaki mereka di antara mereka dan kaki mereka, dan jangan tidak mematuhi Anda dalam Tuhan yang terkenal yang memaafkan, paling berbelas kasih"
13,يَـٰٓأَيُّهَا ٱلَّذِينَ ءَامَنُوا۟ لَا تَتَوَلَّوْا۟ قَوْمًا غَضِبَ ٱللَّهُ عَلَيْهِمْ قَدْ يَئِسُوا۟ مِنَ ٱلْـَٔاخِرَةِ كَمَا يَئِسَ ٱلْكُفَّارُ مِنْ أَصْحَـٰبِ ٱلْقُبُورِ,"Hai orang-orang yang beriman, janganlah kamu jadikan penolongmu kaum yang dimurkai Allah, sesungguhnya mereka telah putus asa terhadap negeri akhirat sebagaimana orang-orang kafir yang telah berada dalam kubur berputus asa.","Wahai orang-orang yang beriman! Janganlah kamu jadikan orang-orang yang dimurkai Allah sebagai penolongmu, sungguh, mereka telah putus asa terhadap akhirat sebagaimana orang-orang kafir yang telah berada dalam kubur juga berputus asa.","O, mereka yang percaya, tidak mengambil alih, orang, Tuhan memberkati mereka, semoga Tuhan memberkati Anda kemuliaan"
