verse_number,arab,king_fahd,kemenag,google_translate
1, قَدْ سَمِعَ ٱللَّهُ قَوْلَ ٱلَّتِى تُجَـٰدِلُكَ فِى زَوْجِهَا وَتَشْتَكِىٓ إِلَى ٱللَّهِ وَٱللَّهُ يَسْمَعُ تَحَاوُرَكُمَآ ۚ إِنَّ ٱللَّهَ سَمِيعٌۢ بَصِيرٌ,"Sesungguhnya Allah telah mendengar perkataan wanita yang memajukan gugatan kepada kamu tentang suaminya, dan mengadukan (halnya) kepada Allah.  Dan Allah mendengar soal jawab antara kamu berdua.  Sesungguhnya Allah Maha Mendengar lagi Maha Melihat.","Sungguh, Allah telah mendengar ucapan perempuan yang mengajukan gugatan kepadamu (Muhammad) tentang suaminya, dan mengadukan (halnya) kepada Allah, dan Allah mendengar percakapan antara kamu berdua. Sesungguhnya Allah Maha Mendengar, Maha Melihat.","Tuhan telah mendengar pepatah bahwa Anda akan memberi Anda suaminya dan tidak setuju dengan Tuhan, dan Tuhan mendengar Anda"
2,ٱلَّذِينَ يُظَـٰهِرُونَ مِنكُم مِّن نِّسَآئِهِم مَّا هُنَّ أُمَّهَـٰتِهِمْ ۖ إِنْ أُمَّهَـٰتُهُمْ إِلَّا ٱلَّـٰٓـِٔى وَلَدْنَهُمْ ۚ وَإِنَّهُمْ لَيَقُولُونَ مُنكَرًا مِّنَ ٱلْقَوْلِ وَزُورًا ۚ وَإِنَّ ٱللَّهَ لَعَفُوٌّ غَفُورٌ,"Orang-orang yang men-ẓihār istrinya di antara kamu, (menganggap istrinya sebagai ibunya, padahal) tiadalah istri mereka itu ibu mereka.  Ibu-ibu mereka tidak lain hanyalah wanita yang melahirkan mereka.  Dan sesungguhnya mereka sungguh-sungguh mengucapkan suatu perkataan yang mungkar dan dusta.  Dan sesungguhnya Allah Maha Pemaaf lagi Maha Pengampun.","Orang-orang di antara kamu yang menzihar istrinya, (menganggap istrinya sebagai ibunya, padahal) istri mereka itu bukanlah ibunya. Ibu-ibu mereka hanyalah perempuan yang melahirkannya. Dan sesungguhnya mereka benar-benar telah mengucapkan suatu perkataan yang mungkar dan dusta. Dan sesungguhnya Allah Maha Pemaaf, Maha Pengampun.",Mereka yang menganggap Anda dari wanita Anda dari apa yang mereka adalah ibu mereka ۖ Ibu mereka hanya untuk mereka ۚ ۚ ۚ ۚ ۚ ۚ ۚ ۚ ۚ ۚ ۚ ۚ ۚ ۚ ۚ ۚ ۚ ۚ ۚ ۚ ۚ ۚ ۚ ۚ ۚ ۚ ۚ ۚ ۚ ۚ ۚ ۚ ۚ ۚ ۚ ۚ ۚ ۚ ۚ ۚ ۚ ۚ ۚ ۚ ۚ ۚ ۚ ۚ ۚ ۚ ۚ ۚ ۚ ۚ ۚ ۚ ۚ ۚ ۚ ۚ ۚ ۚ ۚ ۚ ۚ ۚ ۚ ۚ ۚ ۚ ۚ ۚ
3,وَٱلَّذِينَ يُظَـٰهِرُونَ مِن نِّسَآئِهِمْ ثُمَّ يَعُودُونَ لِمَا قَالُوا۟ فَتَحْرِيرُ رَقَبَةٍ مِّن قَبْلِ أَن يَتَمَآسَّا ۚ ذَٰلِكُمْ تُوعَظُونَ بِهِۦ ۚ وَٱللَّهُ بِمَا تَعْمَلُونَ خَبِيرٌ,"Orang-orang yang men-ẓihār istri mereka, kemudian mereka hendak menarik kembali apa yang mereka ucapkan, maka (wajib atasnya) memerdekakan seorang budak sebelum kedua suami istri itu bercampur.  Demikianlah yang diajarkan kepada kamu, dan Allah Maha Mengetahui apa yang kamu kerjakan.","Dan mereka yang menzihar istrinya, kemudian menarik kembali apa yang telah mereka ucapkan, maka (mereka diwajibkan) memerdekakan seorang budak sebelum kedua suami istri itu bercampur. Demikianlah yang diajarkan kepadamu, dan Allah Mahateliti atas apa yang kamu kerjakan.","Dan mereka yang lebih dari wanita mereka, maka mereka akan kembali ke apa yang mereka katakan, dan pembebasan nama panggilan dari sebelumnya, untuk mempertimbangkan Anda, dan bagi Anda untuk melakukannya. Anda melakukan seorang ahli"
4,فَمَن لَّمْ يَجِدْ فَصِيَامُ شَهْرَيْنِ مُتَتَابِعَيْنِ مِن قَبْلِ أَن يَتَمَآسَّا ۖ فَمَن لَّمْ يَسْتَطِعْ فَإِطْعَامُ سِتِّينَ مِسْكِينًا ۚ ذَٰلِكَ لِتُؤْمِنُوا۟ بِٱللَّهِ وَرَسُولِهِۦ ۚ وَتِلْكَ حُدُودُ ٱللَّهِ ۗ وَلِلْكَـٰفِرِينَ عَذَابٌ أَلِيمٌ,"Barang siapa yang tidak mendapatkan (budak), maka (wajib atasnya) berpuasa dua bulan berturut-turut sebelum keduanya bercampur.  Maka siapa yang tidak kuasa (wajiblah atasnya) memberi makan enam puluh orang miskin.  Demikianlah supaya kamu beriman kepada Allah dan rasul-Nya.  Dan itulah hukum-hukum Allah, dan bagi orang-orang kafir ada siksaan yang sangat pedih.","Maka barangsiapa tidak dapat (memerdekakan hamba sahaya), maka (dia wajib) berpuasa dua bulan berturut-turut sebelum keduanya bercampur. Tetapi barangsiapa tidak mampu, maka (wajib) memberi makan enam puluh orang miskin. Demikianlah agar kamu beriman kepada Allah dan Rasul-Nya. Itulah hukum-hukum Allah, dan bagi orang-orang yang mengingkarinya akan mendapat azab yang sangat pedih.","Siapa pun yang tidak menemukan puasa dua bulan, diikuti oleh dua tahun sebelum ia konsisten dengannya. Dan utusannya ۚ dan itulah batas Tuhan"
5,إِنَّ ٱلَّذِينَ يُحَآدُّونَ ٱللَّهَ وَرَسُولَهُۥ كُبِتُوا۟ كَمَا كُبِتَ ٱلَّذِينَ مِن قَبْلِهِمْ ۚ وَقَدْ أَنزَلْنَآ ءَايَـٰتٍۭ بَيِّنَـٰتٍ ۚ وَلِلْكَـٰفِرِينَ عَذَابٌ مُّهِينٌ,Sesungguhnya orang-orang yang yang menentang Allah dan rasul-Nya pasti mendapat kehinaan sebagaimana orang-orang yang sebelum mereka telah mendapat kehinaan.  Sesungguhnya Kami telah menurunkan bukti-bukti nyata.  Dan bagi orang-orang kafir ada siksa yang menghinakan.,"Sesungguhnya orang-orang yang menentang Allah dan Rasul-Nya pasti mendapat kehinaan sebagaimana kehinaan yang telah didapat oleh orang-orang sebelum mereka. Dan sungguh, kami telah menurunkan bukti-bukti yang nyata. Dan bagi orang-orang yang mengingkarinya akan mendapat azab yang menghinakan.","Bagi mereka yang melakukan Tuhan dan utusan -Nya, mereka telah diberikan, seperti mereka yang ada di hadapan mereka dibayar kembali ۚ dan kami telah mendatangi saya. Siksaan yang memalukan"
6,يَوْمَ يَبْعَثُهُمُ ٱللَّهُ جَمِيعًا فَيُنَبِّئُهُم بِمَا عَمِلُوٓا۟ ۚ أَحْصَىٰهُ ٱللَّهُ وَنَسُوهُ ۚ وَٱللَّهُ عَلَىٰ كُلِّ شَىْءٍ شَهِيدٌ,"Pada hari ketika mereka dibangkitkan Allah semuanya, lalu diberitakan-Nya kepada mereka apa yang telah mereka kerjakan.  Allah mengumpulkan (mencatat) amal perbuatan itu, padahal mereka telah melupakannya.  Dan Allah Maha Menyaksikan segala sesuatu.","Pada hari itu mereka semuanya dibangkitkan Allah, lalu diberitakan-Nya kepada mereka apa yang telah mereka kerjakan. Allah menghitungnya (semua amal perbuatan itu), meskipun mereka telah melupakannya. Dan Allah Maha Menyaksikan segala sesuatu.","The day of God will send them all, and he will tell them about what they did ۚ ۚ God, God bless him and forget him ۚ and God is for everything"
7,أَلَمْ تَرَ أَنَّ ٱللَّهَ يَعْلَمُ مَا فِى ٱلسَّمَـٰوَٰتِ وَمَا فِى ٱلْأَرْضِ ۖ مَا يَكُونُ مِن نَّجْوَىٰ ثَلَـٰثَةٍ إِلَّا هُوَ رَابِعُهُمْ وَلَا خَمْسَةٍ إِلَّا هُوَ سَادِسُهُمْ وَلَآ أَدْنَىٰ مِن ذَٰلِكَ وَلَآ أَكْثَرَ إِلَّا هُوَ مَعَهُمْ أَيْنَ مَا كَانُوا۟ ۖ ثُمَّ يُنَبِّئُهُم بِمَا عَمِلُوا۟ يَوْمَ ٱلْقِيَـٰمَةِ ۚ إِنَّ ٱللَّهَ بِكُلِّ شَىْءٍ عَلِيمٌ,"Tidakkah kamu perhatikan, bahwa sesungguhnya Allah mengetahui apa yang ada di langit dan apa yang ada di bumi? Tiada pembicaraan rahasia antara tiga orang, melainkan Dia-lah yang keempatnya.  Dan tiada (pembicaraan antara) lima orang, melainkan Dia-lah yang keenamnya.  Dan tiada (pula) pembicaraan antara (jumlah) yang kurang dari itu atau lebih banyak, melainkan Dia berada bersama mereka di mana pun mereka berada.  Kemudian Dia akan memberitakan kepada mereka pada hari kiamat apa yang telah mereka kerjakan.  Sesungguhnya Allah Maha mengetahui segala sesuatu.","Tidakkah engkau perhatikan, bahwa Allah mengetahui apa yang ada di langit dan apa yang ada di bumi? Tidak ada pembicaraan rahasia antara tiga orang, melainkan Dialah yang keempatnya. Dan tidak ada lima orang, melainkan Dialah yang keenamnya. Dan tidak ada yang kurang dari itu atau lebih banyak, melainkan Dia pasti ada bersama mereka di mana pun mereka berada. Kemudian Dia akan memberitakan kepada mereka pada hari Kiamat apa yang telah mereka kerjakan. Sesungguhnya Allah Maha Mengetahui segala sesuatu.","Apakah Anda tidak melihat bahwa Tuhan tahu apa yang ada di surga dan apa yang ada di bumi 😂 Apa yang menjadi orang yang bertahan, tetapi itu hanya satu, tetapi itu adalah yang keenam dari mereka adalah yang terendah dari itu, dan tidak ada lagi kecuali untuk mereka, di mana pun mereka tahu"
8,أَلَمْ تَرَ إِلَى ٱلَّذِينَ نُهُوا۟ عَنِ ٱلنَّجْوَىٰ ثُمَّ يَعُودُونَ لِمَا نُهُوا۟ عَنْهُ وَيَتَنَـٰجَوْنَ بِٱلْإِثْمِ وَٱلْعُدْوَٰنِ وَمَعْصِيَتِ ٱلرَّسُولِ وَإِذَا جَآءُوكَ حَيَّوْكَ بِمَا لَمْ يُحَيِّكَ بِهِ ٱللَّهُ وَيَقُولُونَ فِىٓ أَنفُسِهِمْ لَوْلَا يُعَذِّبُنَا ٱللَّهُ بِمَا نَقُولُ ۚ حَسْبُهُمْ جَهَنَّمُ يَصْلَوْنَهَا ۖ فَبِئْسَ ٱلْمَصِيرُ,"Apakah tiada kamu perhatikan, orang-orang yang telah dilarang mengadakan pembicaraan rahasia, kemudian mereka kembali (mengerjakan) larangan itu dan mereka mengadakan pembicaraan rahasia untuk berbuat dosa, permusuhan, dan durhaka kepada rasul.  Dan apabila mereka datang kepadamu, mereka mengucapkan salam kepadamu dengan memberi salam yang bukan sebagai yang ditentukan Allah untukmu.  Dan mereka mengatakan kepada diri mereka sendiri, ""Mengapa Allah tidak menyiksa kita disebabkan apa yang kita katakan itu?"" Cukuplah bagi mereka Jahanam yang akan mereka masuki.  Dan neraka itu adalah seburuk-buruk tempat kembali.","Tidakkah engkau perhatikan orang-orang yang telah dilarang mengadakan pembicaraan rahasia, kemudian mereka kembali (mengerjakan) larangan itu dan mereka mengadakan pembicaraan rahasia untuk berbuat dosa, permusuhan dan durhaka kepada Rasul. Dan apabila mereka datang kepadamu (Muhammad), mereka mengucapkan salam dengan cara yang bukan seperti yang ditentukan Allah untukmu. Dan mereka mengatakan pada diri mereka sendiri, ""Mengapa Allah tidak menyiksa kita atas apa yang kita katakan itu?"" Cukuplah bagi mereka neraka Jahanam yang akan mereka masuki. Maka neraka itu seburuk-buruk tempat kembali.","Apakah Anda tidak melihat kepada mereka yang telah melarang Anda dari para penyintas, maka mereka akan kembali ke tempat yang kami larang dan mereka menyerah dengan milik kami dan jika Anda datang kepada Anda, Anda tidak akan tinggal bersama Anda, dan akan mengatakan kepada mereka sendiri, jika hanya Tuhan yang tidak akan disiksa oleh Tuhan, kesengsaraan nasib nasib nasib nasib dalam diri mereka sendiri, jika Tuhan tidak akan disiksa oleh Tuhan, nasib nasib nasib nasib itu dalam diri mereka sendiri, jika Tuhan tidak akan disiksa oleh Tuhan, nasib nasib nasib nasib mereka sendiri, jika Tuhan tidak disiksa oleh nasib nasib itu"
9,يَـٰٓأَيُّهَا ٱلَّذِينَ ءَامَنُوٓا۟ إِذَا تَنَـٰجَيْتُمْ فَلَا تَتَنَـٰجَوْا۟ بِٱلْإِثْمِ وَٱلْعُدْوَٰنِ وَمَعْصِيَتِ ٱلرَّسُولِ وَتَنَـٰجَوْا۟ بِٱلْبِرِّ وَٱلتَّقْوَىٰ ۖ وَٱتَّقُوا۟ ٱللَّهَ ٱلَّذِىٓ إِلَيْهِ تُحْشَرُونَ,"Hai orang-orang beriman, apabila kamu mengadakan pembicaraan rahasia, janganlah kamu membicarakan tentang membuat dosa, permusuhan, dan durhaka kepada rasul.  Dan bicarakanlah tentang membuat kebajikan dan takwa.  Dan bertakwalah kepada Allah yang kepada-Nya kamu akan dikembalikan.","Wahai orang-orang yang beriman! Apabila kamu mengadakan pembicaraan rahasia, janganlah kamu membicarakan perbuatan dosa, permusuhan dan durhaka kepada Rasul. Tetapi bicarakanlah tentang perbuatan kebajikan dan takwa. Dan bertakwalah kepada Allah yang kepada-Nya kamu akan dikumpulkan kembali.","O, mereka yang aman, ketika Anda tidak, maka jangan datang ke kita dan kesalehan ^ dan takut akan Tuhan, yang akan Anda kumpulkan."
10,إِنَّمَا ٱلنَّجْوَىٰ مِنَ ٱلشَّيْطَـٰنِ لِيَحْزُنَ ٱلَّذِينَ ءَامَنُوا۟ وَلَيْسَ بِضَآرِّهِمْ شَيْـًٔا إِلَّا بِإِذْنِ ٱللَّهِ ۚ وَعَلَى ٱللَّهِ فَلْيَتَوَكَّلِ ٱلْمُؤْمِنُونَ,"Sesungguhnya pembicaraan rahasia itu adalah dari setan, supaya orang-orang yang beriman itu berduka cita, sedang pembicaraan itu tiadalah memberi mudarat sedikit pun kepada mereka, kecuali dengan izin Allah dan kepada Allah-lah hendaknya orang-orang yang beriman bertawakal.","Sesungguhnya pembicaraan rahasia itu termasuk (perbuatan) setan, agar orang-orang yang beriman itu bersedih hati, sedang (pembicaraan) itu tidaklah memberi bencana sedikit pun kepada mereka, kecuali dengan izin Allah. Dan kepada Allah hendaknya orang-orang yang beriman bertawakal.","Sebaliknya, orang yang selamat dari Setan sedih oleh mereka yang percaya pada mereka, dan mereka tidak menghalangi orang -orang percaya"
11,يَـٰٓأَيُّهَا ٱلَّذِينَ ءَامَنُوٓا۟ إِذَا قِيلَ لَكُمْ تَفَسَّحُوا۟ فِى ٱلْمَجَـٰلِسِ فَٱفْسَحُوا۟ يَفْسَحِ ٱللَّهُ لَكُمْ ۖ وَإِذَا قِيلَ ٱنشُزُوا۟ فَٱنشُزُوا۟ يَرْفَعِ ٱللَّهُ ٱلَّذِينَ ءَامَنُوا۟ مِنكُمْ وَٱلَّذِينَ أُوتُوا۟ ٱلْعِلْمَ دَرَجَـٰتٍ ۚ وَٱللَّهُ بِمَا تَعْمَلُونَ خَبِيرٌ,"Hai orang-orang beriman, apabila dikatakan kepadamu, ""Berlapang-lapanglah dalam majelis"", maka lapangkanlah, niscaya Allah akan memberi kelapangan untukmu.  Dan apabila dikatakan, ""Berdirilah kamu"", maka berdirilah, niscaya Allah akan meninggikan orang-orang yang beriman di antaramu dan orang-orang yang diberi ilmu pengetahuan beberapa derajat.  Dan Allah Maha Mengetahui apa yang kamu kerjakan.","Wahai orang-orang yang beriman! Apabila dikatakan kepadamu, ""Berilah kelapangan di dalam majelis-majelis,"" maka lapangkanlah, niscaya Allah akan memberi kelapangan untukmu. Dan apabila dikatakan, ""Berdirilah kamu,"" maka berdirilah, niscaya Allah akan mengangkat (derajat) orang-orang yang beriman di antaramu dan orang-orang yang diberi ilmu beberapa derajat. Dan Allah Mahateliti atas apa yang kamu kerjakan.","O, mereka yang aman, ketika dikatakan kepada Anda, Anda akan dimaafkan dalam gusi, sehingga mereka akan dihapus sehingga mereka membangkitkan Tuhan, mereka yang percaya pada Anda dan mereka yang telah memberikan pengetahuan tentang pengetahuan tersebut"
12,يَـٰٓأَيُّهَا ٱلَّذِينَ ءَامَنُوٓا۟ إِذَا نَـٰجَيْتُمُ ٱلرَّسُولَ فَقَدِّمُوا۟ بَيْنَ يَدَىْ نَجْوَىٰكُمْ صَدَقَةً ۚ ذَٰلِكَ خَيْرٌ لَّكُمْ وَأَطْهَرُ ۚ فَإِن لَّمْ تَجِدُوا۟ فَإِنَّ ٱللَّهَ غَفُورٌ رَّحِيمٌ,"Hai orang-orang beriman, apabila kamu mengadakan pembicaraan khusus dengan rasul hendaklah kamu mengeluarkan sedekah (kepada orang miskin) sebelum pembicaraan itu.  Yang demikian itu adalah lebih baik bagimu dan lebih bersih; jika kamu tiada memperoleh (yang akan disedekahkan),  maka sesungguhnya Allah Maha Pengampun lagi Maha Penyayang.","Wahai orang-orang yang beriman! Apabila kamu mengadakan pembicaraan khusus dengan Rasul, hendaklah kamu mengeluarkan sedekah (kepada orang miskin) sebelum (melakukan) pembicaraan itu. Yang demikian itu lebih baik bagimu dan lebih bersih. Tetapi jika kamu tidak memperoleh (yang akan disedekahkan) maka sungguh, Allah Maha Pengampun, Maha Penyayang.","O, mereka yang aman, ketika utusan datang ke utusan, lalu memberi Anda di antara tangan kesuksesan Anda, dan Anda akan menjadi hal yang baik. Anda menemukan, karena Tuhan memaafkan, paling penyayang"
13,ءَأَشْفَقْتُمْ أَن تُقَدِّمُوا۟ بَيْنَ يَدَىْ نَجْوَىٰكُمْ صَدَقَـٰتٍ ۚ فَإِذْ لَمْ تَفْعَلُوا۟ وَتَابَ ٱللَّهُ عَلَيْكُمْ فَأَقِيمُوا۟ ٱلصَّلَوٰةَ وَءَاتُوا۟ ٱلزَّكَوٰةَ وَأَطِيعُوا۟ ٱللَّهَ وَرَسُولَهُۥ ۚ وَٱللَّهُ خَبِيرٌۢ بِمَا تَعْمَلُونَ,"Apakah kamu takut akan (menjadi miskin) karena kamu memberikan sedekah sebelum pembicaraan dengan rasul? Maka jika kamu tiada memperbuatnya dan Allah telah memberi tobat kepadamu maka dirikanlah salat, tunaikanlah zakat, taatlah kepada Allah dan rasul-Nya; dan Allah Maha Mengetahui apa yang kamu kerjakan.","Apakah kamu takut akan (menjadi miskin) karena kamu memberikan sedekah sebelum (melakukan) pembicaraan dengan Rasul? Tetapi jika kamu tidak melakukannya dan Allah telah memberi ampun kepadamu, maka laksanakanlah salat, dan tunaikanlah zakat serta taatlah kepada Allah dan Rasul-Nya! Dan Allah Mahateliti atas apa yang kamu kerjakan.",Anda telah disepakati untuk menawarkan antara tangan kesuksesan Anda dan kepatuhan kepada Tuhan dan utusan -Nya ۚ dan Tuhan adalah seorang ahli dalam apa yang Anda lakukan
14,۞ أَلَمْ تَرَ إِلَى ٱلَّذِينَ تَوَلَّوْا۟ قَوْمًا غَضِبَ ٱللَّهُ عَلَيْهِم مَّا هُم مِّنكُمْ وَلَا مِنْهُمْ وَيَحْلِفُونَ عَلَى ٱلْكَذِبِ وَهُمْ يَعْلَمُونَ,"Tidakkah kamu perhatikan orang-orang yang menjadikan suatu kaum yang dimurkai Allah sebagai teman? Orang-orang itu bukan dari golongan kamu dan bukan (pula) dari golongan mereka. Dan mereka bersumpah untuk menguatkan kebohongan, sedang mereka mengetahui.","Tidakkah engkau perhatikan orang-orang (munafik) yang menjadikan suatu kaum yang telah dimurkai Allah sebagai sahabat? Orang-orang itu bukan dari (kaum) kamu dan bukan dari (kaum) mereka. Dan mereka bersumpah atas kebohongan, sedang mereka mengetahuinya.","۞ Apakah Anda tidak melihat kepada mereka yang telah mengambil orang yang marah kepada mereka, apa yang berasal dari Anda, atau dari mereka"
15,أَعَدَّ ٱللَّهُ لَهُمْ عَذَابًا شَدِيدًا ۖ إِنَّهُمْ سَآءَ مَا كَانُوا۟ يَعْمَلُونَ,"Allah telah menyediakan bagi mereka azab yang sangat keras, sesungguhnya amat buruklah apa yang telah mereka kerjakan.","Allah telah menyediakan azab yang sangat keras bagi mereka. Sungguh, betapa buruknya apa yang telah mereka kerjakan.",Tuhan berjanji kepada mereka siksaan yang parah. Mereka adalah apa yang mereka lakukan
16,ٱتَّخَذُوٓا۟ أَيْمَـٰنَهُمْ جُنَّةً فَصَدُّوا۟ عَن سَبِيلِ ٱللَّهِ فَلَهُمْ عَذَابٌ مُّهِينٌ,"Mereka menjadikan sumpah-sumpah mereka sebagai perisai, lalu mereka halangi (manusia) dari jalan Allah; karena itu mereka mendapat azab yang menghinakan.","Mereka menjadikan sumpah-sumpah mereka sebagai perisai, lalu mereka menghalang-halangi (manusia) dari jalan Allah; maka bagi mereka azab yang menghinakan.","Mereka membawa mereka sebagai surga, jadi mereka mengusir"
17,لَّن تُغْنِىَ عَنْهُمْ أَمْوَٰلُهُمْ وَلَآ أَوْلَـٰدُهُم مِّنَ ٱللَّهِ شَيْـًٔا ۚ أُو۟لَـٰٓئِكَ أَصْحَـٰبُ ٱلنَّارِ ۖ هُمْ فِيهَا خَـٰلِدُونَ,"Harta benda dan anak-anak mereka tiada berguna sedikit pun (untuk menolong) mereka dari azab Allah.  Mereka itulah penghuni neraka, mereka kekal di dalamnya.","Harta benda dan anak-anak mereka tidak berguna sedikit pun (untuk menolong) mereka dari azab Allah. Mereka itulah penghuni neraka, mereka kekal di dalamnya.","Mereka tidak akan disambut oleh mereka, dan mereka bukan dari mereka, dari Tuhan, sesuatu."
18,يَوْمَ يَبْعَثُهُمُ ٱللَّهُ جَمِيعًا فَيَحْلِفُونَ لَهُۥ كَمَا يَحْلِفُونَ لَكُمْ ۖ وَيَحْسَبُونَ أَنَّهُمْ عَلَىٰ شَىْءٍ ۚ أَلَآ إِنَّهُمْ هُمُ ٱلْكَـٰذِبُونَ,"(Ingatlah) hari (ketika) mereka semua dibangkitkan Allah, lalu mereka bersumpah kepada-Nya (bahwa mereka bukan musyrikin) sebagaimana mereka bersumpah kepadamu; dan mereka menyangka bahwa sesungguhnya mereka akan memperoleh suatu (manfaat).  Ketahuilah bahwa sesungguhnya merekalah orang-orang pendusta.","(Ingatlah) pada hari (ketika) mereka semua dibangkitkan Allah, lalu mereka bersumpah kepada-Nya (bahwa mereka bukan orang musyrik) sebagaimana mereka bersumpah kepadamu; dan mereka menyangka bahwa mereka akan memperoleh sesuatu (manfaat). Ketahuilah, bahwa mereka orang-orang pendusta.","Hari Tuhan akan mengirim mereka semua, dan mereka akan dipecahkan untuk mereka karena mereka diselesaikan untuk Anda."
19,ٱسْتَحْوَذَ عَلَيْهِمُ ٱلشَّيْطَـٰنُ فَأَنسَىٰهُمْ ذِكْرَ ٱللَّهِ ۚ أُو۟لَـٰٓئِكَ حِزْبُ ٱلشَّيْطَـٰنِ ۚ أَلَآ إِنَّ حِزْبَ ٱلشَّيْطَـٰنِ هُمُ ٱلْخَـٰسِرُونَ,Setan telah menguasai mereka lalu menjadikan mereka lupa mengingat Allah; mereka itulah golongan setan.  Ketahuilah bahwa sesungguhnya golongan setan itulah golongan yang merugi.,"Setan telah menguasai mereka, lalu menjadikan mereka lupa mengingat Allah; mereka itulah golongan setan. Ketahuilah, bahwa golongan setan itulah golongan yang merugi.",ٱ ٱ ٱ ٱ ٱ ٱ ٱ ٱ ۚ ۚ ۚ ۚ ۚ ۚ ۚ ۚ ۚ ۚ ۚ ۚ ۚ ۚ ۚ ۚ ۚ ۚ ۚ ۚ ۚ ۚ ۚ ۚ ۚ ۚ ۚ Cross
20,إِنَّ ٱلَّذِينَ يُحَآدُّونَ ٱللَّهَ وَرَسُولَهُۥٓ أُو۟لَـٰٓئِكَ فِى ٱلْأَذَلِّينَ,"Sesungguhnya orang-orang yang menentang Allah dan rasul-Nya, mereka termasuk orang-orang yang sangat hina.","Sesungguhnya orang-orang yang menentang Allah dan Rasul-Nya, mereka termasuk orang-orang yang sangat hina.","Bagi mereka yang memimpin Tuhan dan utusan -Nya, atau mereka yang mengalami penghinaan"
21,كَتَبَ ٱللَّهُ لَأَغْلِبَنَّ أَنَا۠ وَرُسُلِىٓ ۚ إِنَّ ٱللَّهَ قَوِىٌّ عَزِيزٌ,"Allah telah menetapkan, ""Aku dan rasul-rasul-Ku pasti menang"".  Sesungguhnya Allah Maha Kuat lagi Maha Perkasa.","Allah telah menetapkan, ""Aku dan rasul-rasul-Ku pasti menang."" Sungguh, Allah Mahakuat, Mahaperkasa.",Tuhan menulis untuk sebagian besar dari saya dan utusan saya.
22,لَّا تَجِدُ قَوْمًا يُؤْمِنُونَ بِٱللَّهِ وَٱلْيَوْمِ ٱلْـَٔاخِرِ يُوَآدُّونَ مَنْ حَآدَّ ٱللَّهَ وَرَسُولَهُۥ وَلَوْ كَانُوٓا۟ ءَابَآءَهُمْ أَوْ أَبْنَآءَهُمْ أَوْ إِخْوَٰنَهُمْ أَوْ عَشِيرَتَهُمْ ۚ أُو۟لَـٰٓئِكَ كَتَبَ فِى قُلُوبِهِمُ ٱلْإِيمَـٰنَ وَأَيَّدَهُم بِرُوحٍ مِّنْهُ ۖ وَيُدْخِلُهُمْ جَنَّـٰتٍ تَجْرِى مِن تَحْتِهَا ٱلْأَنْهَـٰرُ خَـٰلِدِينَ فِيهَا ۚ رَضِىَ ٱللَّهُ عَنْهُمْ وَرَضُوا۟ عَنْهُ ۚ أُو۟لَـٰٓئِكَ حِزْبُ ٱللَّهِ ۚ أَلَآ إِنَّ حِزْبَ ٱللَّهِ هُمُ ٱلْمُفْلِحُونَ,"Kamu tak akan mendapati kaum yang beriman pada Allah dan hari akhirat, saling berkasih-sayang dengan orang-orang yang menentang Allah dan rasul-Nya, sekalipun orang-orang itu bapak-bapak, atau anak-anak, atau saudara-saudara, ataupun keluarga mereka.  Mereka itulah orang-orang yang telah menanamkan keimanan dalam hati mereka dan menguatkan mereka dengan pertolongan yang datang daripada-Nya.  Dan dimasukan-Nya mereka ke dalam surga yang mengalir di bawahnya sungai-sungai, mereka kekal di dalamnya.  Allah rida terhadap mereka dan mereka pun merasa puas terhadap (limpahan rahmat)-Nya.  Mereka itulah golongan Allah.  Ketahuilah bahwa sesungguhnya golongan Allah itulah golongan yang beruntung.","Engkau (Muhammad) tidak akan mendapatkan suatu kaum yang beriman kepada Allah dan hari akhirat, saling berkasih sayang dengan orang-orang yang menentang Allah dan Rasul-Nya, sekalipun orang-orang itu bapaknya, anaknya, saudaranya atau keluarganya. Mereka itulah orang-orang yang dalam hatinya telah ditanamkan Allah keimanan dan Allah telah menguatkan mereka dengan pertolongan yang datang dari Dia. Lalu dimasukkan-Nya mereka ke dalam surga yang mengalir di bawahnya sungai-sungai, mereka kekal di dalamnya. Allah rida terhadap mereka dan mereka pun merasa puas terhadap (limpahan rahmat)-Nya. Merekalah golongan Allah. Ingatlah, sesungguhnya golongan Allah itulah yang beruntung.","Do not find a people who believe in God and the day, and they will be blessed with whom God and His Messenger will lead Their brothers, or their tenth For the goodness of it in it ۚ May God be pleased with them and may God be pleased with him ۚ or those who are the party of God"
