verse_number,kemenag
1,"Apa yang di langit dan di bumi bertasbih kepada Allah. Dialah Yang Mahaperkasa, Mahabijaksana."
2,"Milik-Nyalah kerajaan langit dan bumi, Dia menghidupkan dan mematikan, dan Dia Mahakuasa atas segala sesuatu."
3,"Dialah Yang Awal, Yang Akhir, Yang Zahir dan Yang Batin; dan Dia Maha Mengetahui segala sesuatu."
4,"Dialah yang menciptakan langit dan bumi dalam enam masa; kemudian Dia bersemayam di atas Arasy. Dia mengetahui apa yang masuk ke dalam bumi dan apa yang keluar dari dalamnya, apa yang turun dari langit dan apa yang naik ke sana . Dan Dia bersama kamu di mana saja kamu berada. Dan Allah Maha Melihat apa yang kamu kerjakan."
5,Milik-Nyalah kerajaan langit dan bumi. Dan hanya kepada Allah segala urusan dikembali­kan.
6,Dia memasukkan malam ke dalam siang dan memasukkan siang ke dalam malam. Dan Dia Maha Mengetahui segala isi hati.
7,Berimanlah kamu kepada Allah dan Rasul-Nya dan infakkanlah (di jalan Allah) sebagian dari harta yang Dia telah menjadikan kamu sebagai penguasanya (amanah). Maka orang-orang yang beriman di antara kamu dan menginfakkan (hartanya di jalan Allah) memperoleh pahala yang besar.
8,"Dan mengapa kamu tidak beriman kepada Allah, padahal Rasul mengajak kamu beriman kepada Tuhanmu? Dan Dia telah mengambil janji (setia)mu, jika kamu orang-orang mukmin."
9,"Dialah yang menurunkan ayat-ayat yang terang (Alquran) kepada hamba-Nya (Muhammad) untuk mengeluarkan kamu dari kegelapan kepada cahaya. Dan sungguh, terhadap kamu Allah Maha Penyantun, Maha Penyayang."
10,"Dan mengapa kamu tidak menginfakkan hartamu di jalan Allah, padahal milik Allah semua pusaka langit dan bumi? Tidak sama orang yang menginfakkan (hartanya di jalan Allah) di antara kamu dan berperang sebelum penaklukan (Mekkah). Mereka lebih tinggi derajatnya daripada orang-orang yang menginfakkan (hartanya) dan berperang setelah itu. Dan Allah menjanjikan kepada masing-masing mereka (balasan) yang lebih baik. Dan Allah Mahateliti atas apa yang kamu kerjakan."
11,"Barangsiapa meminjamkan kepada Allah dengan pinjaman yang baik, maka Allah akan mengembalikannya berlipat ganda untuknya, dan baginya pahala yang mulia,"
12,"pada hari engkau akan melihat orang-orang yang beriman laki-laki dan perempuan, betapa cahaya mereka bersinar di depan dan di samping kanan mereka, (dikatakan kepada mereka), ""Pada hari ini ada berita gembira untukmu, (yaitu) surga-surga yang mengalir di bawahnya sungai-sungai, mereka kekal di dalamnya. Demikianlah kemenangan yang agung."""
13,"Pada hari orang-orang munafik laki-laki dan perempuan berkata kepada orang-orang yang beriman, ""Tunggulah kami! Kami ingin mengambil cahayamu."" (Kepada mereka) dikatakan, ""Kembalilah kamu ke belakang dan carilah sendiri cahaya (untukmu)."" Lalu di antara mereka dipasang dinding (pemisah) yang berpintu. Di bagian dalam ada rahmat dan di luarnya hanya ada azab."
14,"Orang-orang munafik memanggil orang-orang mukmin, ""Bukankah kami dahulu bersama kamu?"" Mereka menjawab, ""Benar, tetapi kamu mencelakakan dirimu sendiri, dan kamu hanya menunggu, meragukan (janji Allah) dan ditipu oleh angan-angan kosong sampai datang ketetapan Allah; dan penipu (setan) datang memperdaya kamu tentang Allah."
15,"Maka pada hari ini tidak akan diterima tebusan dari kamu maupun dari orang-orang kafir. Tempat kamu di neraka. Itulah tempat berlindungmu, dan itulah seburuk-buruk tempat kembali."""
16,"Belum tibakah waktunya bagi orang-orang yang beriman, untuk secara khusyuk mengingat Allah dan mematuhi kebenaran yang telah diwahyukan (kepada mereka), dan janganlah mereka (berlaku) seperti orang-orang yang telah menerima kitab sebelum itu, kemudian mereka melalui masa yang panjang sehingga hati mereka menjadi keras. Dan banyak di antara mereka menjadi orang-orang fasik."
17,"Ketahuilah bahwa Allah yang menghidupkan bumi setelah matinya (kering). Sungguh, telah Kami jelaskan kepadamu tanda-tanda (kebesaran Kami) agar kamu mengerti."
18,"Sesungguhnya orang-orang yang bersedekah baik laki-laki maupun perempuan dan meminjamkan kepada Allah dengan pinjaman yang baik, akan dilipatgandakan (balasannya) bagi mereka; dan mereka akan mendapat pahala yang mulia."
19,"Dan orang-orang yang beriman kepada Allah dan rasul-rasul-Nya, mereka itu orang-orang yang tulus hati (pecinta kebenaran) dan saksi-saksi di sisi Tuhan mereka. Mereka berhak mendapat pahala dan cahaya. Tetapi orang-orang yang kafir dan mendustakan ayat-ayat Kami, mereka itu penghuni-penghuni neraka."
20,"Ketahuilah, sesungguhnya kehidupan dunia itu hanyalah permainan dan senda gurauan, perhiasan dan saling berbangga di antara kamu serta berlomba dalam kekayaan dan anak keturunan, seperti hujan yang tanam-tanamannya mengagumkan para petani; kemudian (tanaman) itu menjadi kering dan kamu lihat warnanya kuning kemudian menjadi hancur. Dan di akhirat (nanti) ada azab yang keras dan ampunan dari Allah serta keridaan-Nya. Dan kehidupan dunia tidak lain hanyalah kesenangan yang palsu."
21,"Berlomba-lombalah kamu untuk mendapatkan ampunan dari Tuhanmu dan surga yang luasnya seluas langit dan bumi, yang disediakan bagi orang-orang yang beriman kepada Allah dan rasul-rasul-Nya. Itulah karunia Allah, yang diberikan kepada siapa yang Dia kehendaki. Dan Allah mempunyai karunia yang besar."
22,"Setiap bencana yang menimpa di bumi dan yang menimpa dirimu sendiri, semuanya telah tertulis dalam Kitab (Lauḥ Maḥfūẓ) sebelum Kami mewujudkannya. Sungguh, yang demikian itu mudah bagi Allah."
23,"Agar kamu tidak bersedih hati terhadap apa yang luput dari kamu, dan tidak pula terlalu gembira terhadap apa yang diberikan-Nya kepadamu. Dan Allah tidak menyukai setiap orang yang sombong dan membanggakan diri,"
24,"yaitu orang-orang yang kikir dan menyuruh orang lain berbuat kikir. Barangsiapa berpaling (dari perintah-perintah Allah), maka sesungguhnya Allah, Dia Mahakaya, Maha Terpuji."
25,"Sungguh, Kami telah mengutus rasul-rasul Kami dengan bukti-bukti yang nyata dan Kami turunkan bersama mereka Kitab dan neraca (keadilan) agar manusia dapat berlaku adil. Dan Kami menciptakan besi yang mempunyai kekuatan hebat dan banyak manfaat bagi manusia, dan agar Allah mengetahui siapa yang menolong (agama)-Nya dan rasul-rasul-Nya walaupun (Allah) tidak dilihatnya. Sesungguhnya Allah Mahakuat, Mahaperkasa."
26,"Dan sungguh, Kami telah mengutus Nuh dan Ibrahim dan Kami berikan kenabian dan kitab (wahyu) kepada keturunan keduanya, di antara mereka ada yang menerima petunjuk dan banyak di antara mereka yang fasik."
27,"Kemudian Kami susulkan rasul-rasul Kami mengikuti jejak mereka dan Kami susulkan (pula) Isa putra Maryam; Dan Kami berikan Injil kepadanya dan Kami jadikan rasa santun dan kasih sayang dalam hati orang-orang yang mengikutinya. Mereka mengada-adakan raḥbāniyyah, padahal Kami tidak mewajibkannya kepada mereka (yang Kami wajibkan hanyalah) mencari keridaan Allah, tetapi tidak mereka pelihara dengan semestinya. Maka kepada orang-orang yang beriman di antara mereka Kami berikan pahalanya, dan banyak di antara mereka yang fasik."
28,"Wahai orang-orang yang beriman! Bertakwalah kepada Allah dan berimanlah kepada Rasul-Nya (Muhammad), niscaya Allah memberikan rahmat-Nya kepada dua bagian, dan menjadikan cahaya untukmu yang dengan cahaya itu kamu dapat berjalan serta Dia mengampuni kamu. Dan Allah Maha Pengampun, Maha Penyayang,"
29,"agar Ahli Kitab mengetahui bahwa sedikit pun mereka tidak akan mendapat karunia Allah (jika mereka tidak beriman kepada Muhammad), dan bahwa karunia itu ada di tangan Allah, Dia memberikannya kepada siapa yang Dia kehendaki. Dan Allah mempunyai karunia yang besar."
