verse_number,kemenag
1,"Apa yang ada di langit dan apa yang ada di bumi bertasbih kepada Allah; dan Dialah Yang Mahaperkasa, Mahabijaksana."
2,Wahai orang-orang yang beriman! Mengapa kamu mengatakan sesuatu yang tidak kamu kerjakan?
3,(Itu) sangatlah dibenci di sisi Allah jika kamu mengatakan apa-apa yang tidak kamu kerjakan.
4,"Sesungguhnya Allah mencintai orang-orang yang berperang di jalan-Nya dalam barisan yang teratur, mereka seakan-akan seperti suatu bangunan yang tersusun kokoh."
5,"Dan (ingatlah) ketika Musa berkata kepada kaumnya, ""Wahai kaumku! Mengapa kamu menyakitiku, padahal kamu sungguh mengetahui bahwa sesungguhnya aku utusan Allah kepadamu?"" Maka ketika mereka berpaling (dari kebenaran), Allah memalingkan hati mereka. Dan Allah tidak memberi petunjuk kepada kaum yang fasik."
6,"Dan (ingatlah) ketika Isa Putra Maryam berkata, ""Wahai Bani Israil! Sesungguhnya aku utusan Allah kepadamu, yang membenarkan kitab (yang turun) sebelumku, yaitu Taurat dan memberi kabar gembira dengan seorang rasul yang akan datang setelahku, yang namanya Ahmad (Muhammad)."" Namun ketika Rasul itu datang kepada mereka dengan membawa bukti-bukti yang nyata, mereka berkata, ""Ini adalah sihir yang nyata."""
7,Dan siapakah yang lebih zalim daripada orang yang mengada-adakan kebohongan terhadap Allah padahal dia diajak kepada (agama) Islam? Dan Allah tidak memberi petunjuk kepada orang-orang yang zalim.
8,"Mereka hendak memadamkan cahaya (agama) Allah dengan mulut (ucapan-ucapan) mereka, tetapi Allah tetap menyempurnakan cahaya-Nya meskipun orang-orang kafir membencinya."
9,"Dialah yang mengutus Rasul-Nya dengan membawa petunjuk dan agama yang benar, untuk memenangkannya di atas segala agama meskipun orang-orang musyrik membencinya."
10,Wahai orang-orang yang beriman! Maukah kamu Aku tunjukkan suatu perdagangan yang dapat menyelamatkan kamu dari azab yang pedih?
11,"(Yaitu) kamu beriman kepada Allah dan Rasul-Nya dan berjihad di jalan Allah dengan harta dan jiwamu. Itulah yang lebih baik bagi kamu jika kamu mengetahui,"
12,"niscaya Allah mengampuni dosa-dosamu dan memasukkan kamu ke dalam surga yang mengalir di bawahnya sungai-sungai, dan ke tempat-tempat tinggal yang baik di dalam surga 'Ādn. Itulah kemenangan yang agung."
13,Dan (ada lagi) karunia lain yang kamu sukai (yaitu) pertolongan dari Allah dan kemenangan yang dekat (waktunya). Dan sampaikanlah berita gembira kepada orang-orang mukmin.
14,"Wahai orang-orang yang beriman! Jadilah kamu penolong-penolong (agama) Allah sebagaimana Isa putra Maryam telah berkata kepada pengikut-pengikutnya yang setia, ""Siapakah yang akan menjadi penolong-penolongku (untuk menegakkan agama) Allah?"" Pengikut-pengikutnya yang setia itu berkata, ""Kamilah penolong-penolong (agama) Allah,"" lalu segolongan dari Bani Israil beriman dan segolongan (yang lain) kafir; lalu Kami berikan kekuatan kepada orang-orang yang beriman terhadap musuh-musuh mereka, sehingga mereka menjadi orang-orang yang menang."
